Title,Description
build your own darkweb escrow market.,Want a dark web market place?  Full script and instructions for building your own escrow DW market place.  If you get stuck (Although i prefer non noobs to buy this) for a small fee i will help out.  ...
blackbullet 2.1.6,Blackbullet 2.1.6
full market source code - tochka - point market,"FULL MARKET SOURCE CODE - Tochka - Point Market - - Start your own market 

You will get an instant downloadable link to get the source code


Thank you"
openbullet compiled cracking tool + 700 configs,"The best cracking tool on the market, you will not be disappointed with this program. 

The program is already compiled and I have included my collection of 700 configs so you can get started cracking..."
silk road 3.1 - full market source code,"Silk Road 3.1 - FULL MARKET SOURCE CODE

Silk Road 3.1 - FULL MARKET SOURCE CODE - Original Owner Source Code.

You can start Your Own Market right now.

A lot of Market are using this Source code the..."
adobe master collection cc 2023,"Adobe Master Collection CC 2023 does not exist in nature Adobe has never released it.
 But nevertheless he is in front of you And it is assembled on the basis of a modern installer 
manufactured by Ad..."
2023 antidetect 7.3 + fraudfox vm + ccleanerpro,"2023 ANTIDETECT 7.3 + FRAUDFOX VM + CCLEANERPRO
ANTI DETECT BROWSER

Anti detect is perhaps considered the best and secure browser in the world because of its many features including

BROWSER FINGERPR..."
hotspot shield premium vpn 9.5.9,"Hotspot Shield Premium VPN 9.5.9
Ranked as one of the most powerful VPNs in the world regarding its Blazing fast speed Security and Ease of use in most of the popular review websites


PROs:
Incredibl..."
sqli dumper v.10 pro,"SQLi Dumper v.10 Pro

SQLi Dumper v.10 Pro  


Designed to be automated to find and exploit web security vulnerabilities in mass from worldwide
It is robust, works in the background threads and is sup..."
vmware latest version licence lifetime,VMware Latest version Licence Lifetime
antidetect 7.3 + fraudfox vm +4000configs 2023,"INSTANT DELIVERY TO YOUR INBOX

ANTI DETECT BROWSER

Anti detect is perhaps considered the best and secure browser in the world
because of its many features including

?BROWSER FINGERPRINT

WHAT IS A ..."
latest antidetect 7.3 +4000 configs 2023,"INSTANT  DELIVERY TO YOUR INBOX

ANTI DETECT BROWSER

Anti detect is perhaps considered the best and secure browser in the world
because of its many features including

?BROWSER FINGERPRINT

WHAT IS A..."
ultrabox portable,"Portable version - take with you , leave no traces."
internet download manager - 5x faster downloading,"Internet Download Manager v6.25. Added Windows 10 compatibility. Fixed compatibility problems with different browsers including Internet Explorer 11, all Mozilla Firefox versions up to Mozilla Firefox..."
photomizer 3 - optimize and repair digital photos,"Optimize and repair digital photos

Photomizer 3 – The test winner is even better now!

The possibilities of picture editing are nearly unlimited- but unfortunately often even for professionals very..."
atlantis word processor portable,Portable alternative for Word. Take you work with you secured on USB flash.
glary utilities pro,"Glary Utilities Pro 5

* Provides a one-stop solution for PC performance optimization

* Boosts PC speed and fixes frustrating errors, crashes and freezes

* Features one-click functionality and easy,..."
android emulator - must have for every proof,BlueStacks is an easy to use and powerful App Player which is designed to run Android OS and apps on Windows PCs with instant switch between Android and Windows. No reboot is required. End consumers c...
apple pay carding guide make thousands updated,"★★★★INSTANT  DELIVERY TO YOUR INBOX★★★★

I would first like to introduce myself. My name is breadsdrugged,I have spent more than 5 years making money online with sly methods. 
I have a..."
adobe acrobat pro dc 2023 - cracked,"Cracked stable version - no activation

Numerous tools are present for creating and editing PDF documents but no tool is mature enough as compared to Acrobat Pro DC. It has a variety of tools and opti..."
activate any windows or office easy and for free,"Activation of all version of Windows and Microsoft Office. Process is very simply through software and doesn't need any programmers skill. 

We decline any responsibility on the use you will have with..."
want to build your dream house,"Want to build your dream house? Add a room to your home? Whatever your drawing needs, 
Home Plan Pro is your best choice. It is so easy to learn how to use, you can begin drawing plans within minutes...."
wise care 365 full,"Clean registry and junk files from your PCs. Protect your privacy and make your PCs more secure. Provide a better option of optimizing and accelerating your computer!

Over 30,000,000 downloads worldw..."
western union and moneygram guide cc/cvv,"★★★★INSTANT  DELIVERY TO YOUR INBOX★★★★

This method is the fastest cashout method available at this tine and the
easiest. If done right you can cashout multiple times in one day.


We..."
make big money on darkmarkets become vendor guide,"INSTANT  DELIVERY TO YOUR INBOX

How to make BIG MONEY on DARKMARKETS 100% WORKING  NO BULLSHIT  step by
step guide.

You will learn to sell guides and tutorials in the dark market. I have more
than $..."
"onion updated deepweb links 16,000+ cream of onion","INSTANT DELIVERY TO YOUR INBOX

THESE ARE THE LATEST AND THE GREATEST OF TOR FOR 2023.

THIS IS THE MOST UP TO DATE AND LARGEST 2023 LIST OF DEEPWEB LINKS ON
THE MARKETS. JUNE 1 2023 UPDATED

IF YOU C..."
ashampoo burning studio,"Burning just got a lot easier

Discover the best Burning Studio of all time! Clearer, faster and more user-friendly than any Burning Studio before it. More than 500 enhancements throughout all modules..."
process lasso.pro cracked - speed up your pc,"Windows, by design, allows programs to monopolize your CPU — leading to hangs, micro-lags, freezing (even crashing) and delays in your keystroke and/or mouse actions.

Process Lasso is NOT yet anoth..."
[DD] rosetta stone (pc and mac) all languages – instant,"Welcome,

Discover how obtain for FREE the ROSETTA STONE software

Includes all the following languages-

ARABIC 1-2-3
CHINESE MANDARIN LEVEL 1-2-3
RSV3 DUTCH 1-2-3
RSV3 ENGLISH AMERICAN LEVEL 1-2-3-4..."
make $20k selling branded counterfeit watches ebay,"★★★★★INSTANT DELIVERY TO YOUR INBOX★★★★★

MAKE $20k SELLING BRANDED COUNTERFEIT WATCHES ON EBAY

MAKE OVER $20,000 A WEEK SELLING BRANDED COUNTERFEIT WATCHES ON EBAY -
ARMANI, MICH..."
windows 10 - guide and software for stop spying,"Afraid about Microsoft spying. Windows 10 is full features available to do that. This easy guide will solve this problem. Comes with software to protect your privacy in Win 10. 

We decline any respon..."
how to safely pass counterfeit money,"★★★INSTANT DELIVERY TO YOUR INBOX★★★

This will teach you how to safely pass counterfeit money."
watch me cashout credit card in front of you,"INSTANT DELIVERY TO YOUR INBOX

Watch me cashing out CC right in front of your eyes. 
COPY ME and make some  
Don t BUY crap outdated guides, get a real VIDEO TUTORIAL and never look
back  

Probably ..."
cc validator ++ ipbin ++ bin checker ++bin search,"INSTANT DELIVERY TO YOUR INBOX

Validate, Verify  Check Credit Card or Debit Card Number

This checker will support all major credit and debit card brands: VISA,
MasterCard, American Express, Diners C..."
android carding setup no rooting cashout hacking,"★★★★INSTANT DELIVERY TO YOUR INBOX★★★★

THIS IS THE BEST AND EASIEST GUIDE TO MAKING YOUR ANDROID DEVICE A CARDING
WEAPON, NO BULLSHIT.

EASY TO SETUP, NO ROOTING YOUR PHONE NEEDED, AL..."
easy cardable low security website list 10 000,"INSTANT DELIVERY TO YOUR INBOX

THIS LIST OF 10000 SITES WILL KEEP YOU BUSY FOR A LONG TIME.  STOP FAILING
AT THE MAJOR BULLSHIT SITES AND START WHERE THE PROS DO. 


CHECK OUT THE REST OF MY DIGITAL ..."
uber fraud pack make $2500 monthly,"INSTANT DELIVERY TO YOUR INBOX


This is VERY EASY to do and use and Replicate so you can literally
retire if you have enough accounts getting paid.

This quick and complete guide explains you how to ..."
$2752 ultimate poker cc cashout works worldwide,"INSTANT  DELIVERY TO YOUR INBOX

If you are searching for a carding method that:

-Cant get burned
-Its all virtual
-Makes you super rich

This guide will teach you how to cashout while anywhere in th..."
socks5 clean proxy - socks + country + city + zip,"VERY IMPORTANT!
I will provide the closest socks5 based on your request. 
The proxy will usually work for 12 HOURS, more if you are lucky. Plenty of time to do what you need. This is NOT a lifetime pr..."
aida64,"Best software and hardware diagnostic system.

AIDA64 has a hardware detection engine unrivaled in its class. It provides detailed information about installed software and offers diagnostic functions ..."
office 365 - all versions + activator,"Office 365 Home Premium , Pro Plus , Small Business Personal

Office 365 is popular software which is used to produce any document files. This new office delivered fast to all your Windows devices. It..."
windows iso download - any version any language,"You need installation ISO of Windows 7,8,10 ?

Any version any language directly and fast downloadable to your computer. It's full versions with all Service Packs included. 

We decline any responsibi..."
change your mac by one click,"Change your MAC by one click - must have for security


Changing of MAC address is one of most important things when you carding or doing

other things on Darknet. This software allow you do that on v..."
slysoft.anydvd.hd cracked - remove protection from,"AnyDVD HD is a Windows based application that removes restrictions of DVD and Blu-ray media automatically in the background.

AnyDVD HD works in the background to automatically and transparently enabl..."
guide cc/cvv to gift cards including video,"INSTANT DELIVERY TO YOUR INBOX
Latest guides and videos on how to CASHOUT to gift cards!
This is a pack of multiple guides on gift carding and a list of easily
cardable websites to go with it."
winrar 5.30 cracked 32 bit and 64 bit versions,"Best archiver ever made !

WinRAR is a powerful archive manager. It can backup your data and reduce the size of email attachments, decompress RAR, ZIP and other files downloaded from Internet and crea..."
print usps/fedex/canada post labels anonymous,"★★★INSTANT DELIVERY TO YOUR INBOX★★★

-Dhl is also sometimes available

If you are looking for printed labels for your packages but want to stay
anonymous then this is for you.  I scoured ..."
flash disk repair,"Best utility to repair your unreadable USB flash disk !!!
Save your data , working in most cases !!!"
amazon refund guide - extremely detailed,"INSTANT DELIVERY TO YOUR INBOX

This guide contains all the knowledge you need to successfully rape amazon
and never be caught, and what you do with this knowledge, is entirely up to
you.
This guide w..."
total commander full,"Total Commander v8.52a

best file manager ever"
one click mac address changer,"INSTANT  DELIVERY TO YOUR INBOX


 This is the easiest and most effective Mac Address changer on the
market."
mac - run windows on your mac - parallels desktop,Parallels Desktop Business Edition 13.1.0 For MAC Cracked Full Version
poweriso 6.6,"PowerISO is a powerful CD / DVD / BD image file processing tool, which allows you to open, extract, burn, create, edit, compress, encrypt, split and convert ISO files, and mount ISO files with interna..."
