Heading,Tab1,Tab2,Price,Stats,Comment,CommentInfo
magix sound forge pro suite v14 + patch aug 2023,The complete bundle for editing  restoration  sound design and mastering. SOUND FORGE Pro Suite is here. Designed to be the complete package for recording  editing and processing audio at the highest quality standards and bundled together with many renowned audio shaping and enhancing plugins. With SOUND FORGE Pro Suite  new standards in the professional audio industry are set.  Features Total audio editing power SOUND FORGE Pro Suite was designed to be the complete package of audio applications to record  edit and process audio at the highest possible standard. At its core is the new SOUND FORGE Pro 12 that features 64-bit processing  VST3 effect support  plug-ins from the advanced SEQUOIA system and many renowned audio shaping and enhancing plug-ins. Add the sound design inspiration of SpectraLayers Pro 5 and you have a suite of software that continues to set new standards for audio professionals. Sound design that can be seen and heard SpectraLayers Pro transforms sound into a uniqu,Non refundable  software just works if links are broke  please contact me first,2.28 USD,2385 127 0,Comments (0),
guide cc/cvv to gift cards including video,INSTANT DELIVERY TO YOUR INBOX Latest guides and videos on how to CASHOUT to gift cards! This is a pack of multiple guides on gift carding and a list of easily cardable websites to go with it.,No refunds.,5.70 USD,2378 127 0,Comments (0),
proxifier latest version 3.42 may2023 instant,Proxifier 3.42 may 2023 instant  Latest version of Proxifier  to control apps or your whole system to proxy. you can download the trial from the website and activate it with this code  delivery is Serial number only,,2.28 USD,2385 127 0,Comments (2),s********: THANKSb**********: Awesome just wish I knew how it worked lol
vcw - virtual cam whore - 9 commands,VCW - Virtual Cam Whore - 9 Commands  List of Commands: Wave Typing Suck 2 fingers Take off bra Topless typing Topless rub boobs Watch screen Take off panties Start pussy play,,28.50 USD,4512 157 0,Comments (0),
print usps/fedex/canada post labels anonymous,★★★INSTANT DELIVERY TO YOUR INBOX★★★  -Dhl is also sometimes available  If you are looking for printed labels for your packages but want to stay anonymous then this is for you.  I scoured the net and found a site that you can print any and all labels for usps  fedex  and canada post.  Stop putting stamps and writing the addresses  its too obvious now and most packages with stamps get busted. You need professional printed labels for your packages.    Priority First class Overnight Express International first class/express And many many more options.,No refunds.,5.70 USD,1902 129 0,Comments (0),
android imsi-catcher detector alpha,Android IMSI-Catcher Detector  AIMSICD is an Android app to detect IMSI-Catchers. These devices are false mobile towers base stations acting between the target mobile phones and the real towers of service providers. As such they are considered a Man-In-The-Middle MITM attack. This surveillance technology is also known as StingRay  Cellular Interception and alike.,Everything in my listing is written or tested by me so everything works normally. But if you have a issue you can just send a pm and then I will help you to fix it. I dont refund any order but I can replace the order with another product of my shop if you are not satisfied.,112.86 USD,2275 190 0,Comments (0),
idflow 5.1 cracked,IDFlow 5.1 Cracked  We promise - Your order will be delivered instantly. - If you are not satisfied with your order we will refund your order.,,2.28 USD,1810 129 0,Comments (0),
tenorshare 4mekey and passfab activation unlocker,Read carefully what is supported and what not on the website of Tenorshare and PassFAb. this is working according to some 10 customers on Empire again read carefully Pro  Safe to Remove iCloud Activation Lock without Much Effort Fast remove iCloud activation lock without password/Apple ID Unlock iCloud account anytime  anywhere when you forgot password or bought iPhone iCloud locked Log into App Store with new Apple ID after bypassing activation lock on iPhone/iPad/iPod touch Compatible with iOS devices from iPhone 5S to iPhone X support iOS 12.3-13.6,Non refundable  software just works. if you not succeed in unlocking your phone  it will no result in getting your money back from me,2.28 USD,1953 124 0,Comments (0),
vcw - virtual cam whore - rebeca - 40+ commands,VCW - Virtual Cam Whore - Rebeca - 40+ Commands  List of Commands: See Photo,,28.50 USD,4512 157 0,Comments (0),
walmart gift card generator + checker  working 20,Walmart Gift Card Generator + Checker  Working 2023   Features: - Fully automatic. - Works world wide. - You can get store balance. - When you get a valid gift card it will show: Gift card number:Amount:PIN  Instructions for proper use: 1. Open the generator. 2. simply choose the amount of gift cards you would like to generate and press enter. it will automatically check if the gift cards are valid.,Walmart Gift Card Generator + Checker  Working 2021   Features: - Fully automatic. - Works world wide. - You can get store balance. - When you get a valid gift card it will show: Gift card number:Amount:PIN  Instructions for proper use: 1. Open the generator. 2. simply choose the amount of gift cards you would like to generate and press enter. it will automatically check if the gift cards are valid.,28.50 USD,4512 157 0,Comments (2),c**********: quick deliveryj*************: Would recommend seller! Will buy from this vendor again soon. Quick and accurate!
fl studio producer edition +sign bundle v20.7.2. a,FL Studio 20 is a fully featured  open-architecture music creation and production environment for PC. It features a graphical user interface which is based on a music sequencer. This digital audio workstation has everything you need in one package to compose  arrange  record  edit  mix and master professional quality music.FL Studio 20 is the fastest way from your brain to your speakers. No extra software is required to produce any style of music  because a complete kit of instruments and studio tools is included in the cost of the package.With the included plugins  sounds and tools the user can create complete songs  backing tracks  loops or sizzling beats. The software offers VST Virtual Studio Technology which makes it compatible with other workstations.,Non refundable  software just works. contact me if links are broke,2.28 USD,2386 127 0,Comments (0),
vcw - virtual cam whore - denisa v4 - 45+ commands,VCW - Virtual Cam Whore - Denisa V4 - 45+ Commands  List of Commands: See Photo,,28.50 USD,4512 157 0,Comments (0),
make big money on darkmarkets become vendor guide,INSTANT  DELIVERY TO YOUR INBOX  How to make BIG MONEY on DARKMARKETS 100% WORKING  NO BULLSHIT  step by step guide.  You will learn to sell guides and tutorials in the dark market. I have more than $ 500 a day and sometimes much more using this method. It is easy ... Stop working and get a better life. Easy money for all. Noob friendly.  No long boring lectures here. All I will tell you is this  if you’re the type who feels taking from others is immoral  wrong  harsh  etc  then this isn’t for you. Your best bet is to look for a 9 to 5 or offer your services to a church and don’t bother to reading on.,No refunds.,5.70 USD,2379 127 0,Comments (0),
vcw - virtual cam whore - eleonnora v3 - 50+ comma,VCW - Virtual Cam Whore - Eleonnora V3 - 50+ Commands  List of Commands: See Photo,,28.50 USD,4512 157 0,Comments (0),
onion updated deepweb links 16 000+ cream of onion,INSTANT DELIVERY TO YOUR INBOX  THESE ARE THE LATEST AND THE GREATEST OF TOR FOR 2023.  THIS IS THE MOST UP TO DATE AND LARGEST 2023 LIST OF DEEPWEB LINKS ON THE MARKETS. JUNE 1 2023 UPDATED  IF YOU CAN DREAM IT AND CANT FIND IT ON DREAM MARKET THEN YOU WILL FIND IT ON THESE LISTS.  Be careful on the darknet.,No refunds.,5.70 USD,2379 127 0,Comments (0),
mac osx 100 tools in 1 download - 5 usd,100 tools in 1 download  see screenshots whats in there MAC ONLY software most of it dates 2023  so not very old crap i am selling,Non refundable   software just works,2.28 USD,2386 127 0,Comments (0),
vcw - virtual cam whore - denisa v3 - 50+ commands,VCW - Virtual Cam Whore - Denisa V3 - 50+ Commands  List of Commands: See Photo,,28.50 USD,4512 157 0,Comments (0),
amazon refund guide - extremely detailed,INSTANT DELIVERY TO YOUR INBOX  This guide contains all the knowledge you need to successfully rape amazon and never be caught  and what you do with this knowledge  is entirely up to you. This guide was written on years of experience and some of the information you will read was provided by an ex amazon employee and his name will be provided next to it.,No refunds.,5.70 USD,2379 127 0,Comments (0),
$2752 ultimate poker cc cashout works worldwide,INSTANT  DELIVERY TO YOUR INBOX  If you are searching for a carding method that:  -Cant get burned -Its all virtual -Makes you super rich  This guide will teach you how to cashout while anywhere in the world using gambling and poker Method involves carding and cashing out easy.,No refunds.,5.70 USD,2379 127 0,Comments (0),
nintendo gift card generator + checker  working 2,Nintendo Gift Card Generator + Checker  Working 2023   Features: - Fully automatic. - Works world wide. - You can get store balance or games. - When you get a valid gift card it will show: Gift card number:Amount or Game:Country  Instructions for proper use: 1. Open the generator. 2. simply choose the amount of gift cards you would like to generate and press enter. it will automatically check if the gift cards are valid.,Nintendo Gift Card Generator + Checker  Working 2021   Features: - Fully automatic. - Works world wide. - You can get store balance or games. - When you get a valid gift card it will show: Gift card number:Amount or Game:Country  Instructions for proper use: 1. Open the generator. 2. simply choose the amount of gift cards you would like to generate and press enter. it will automatically check if the gift cards are valid.,28.50 USD,4512 157 0,Comments (0),
cc validator ++ ipbin ++ bin checker ++bin search,INSTANT DELIVERY TO YOUR INBOX  Validate  Verify  Check Credit Card or Debit Card Number  This checker will support all major credit and debit card brands: VISA  MasterCard  American Express  Diners Club JCB  Voyager  Once you type in just the number of the card it will give you this information: BIN   Account Number   Checksum   BIN Details Details for BIN  BIN   Issuing Bank   Card Brand   Card Type   Card Level   ISO Country Name   ISO Country A2   ISO Country A3   ISO Country Number   Issuers Website   Issuers Contact    Combo IP/BIN Checker and Validator   IP/BIN Checker tool is designed to check a possibility of fraud for credit card transactions. The IP address is used to find the customers current location while the bank identification number BIN identifies the card issuing bank and its country of issuance. Both checks will allow specific combinations of two countries thus identified whether the transaction to be accepted or rejected.  Both IP address and Bank,No refunds.,5.70 USD,2379 127 0,Comments (0),
vcw - virtual cam whore - 38 commands,VCW - Virtual Cam Whore - 38 Commands  List of Commands:  Type Wave Blow Kiss Disconnect Camera Fake Error Fix Error Heart Sign Hi 5 Kiss Cam Laugh Mic Fix Middle Finger No way Peace Sign Phone Call Play w Tits Room - leave Room - return to room Show Boobs Shows Butt Look at screen Complete Show - topless Gag sequence - Dad Enter - topless ======== Hats ======== Baltimore Orieles Dallas Cowboys NY Jets NY Mets NJ Nets 2 NJ Nets NY Yankees Phili 76ers Phili Eagles Fhili Flyers Pitts Steelers SF 49ers ======== Show ID ======== California Florida Pennsylvania New York,,28.50 USD,4512 157 0,Comments (1),j*************: Exactly what I ordered and instant delivery!
ccleaner 5.70 professional latest version aug 2023,Ccleaner pro 5.70 + keygen 100% virusfree  triple checked youll get a download link  you can use that to receive update frequently  every time there is some new version  ill put it in the same link,non refundable  software just works,2.28 USD,2386 127 0,Comments (0),
android carding setup no rooting cashout hacking,★★★★INSTANT DELIVERY TO YOUR INBOX★★★★  THIS IS THE BEST AND EASIEST GUIDE TO MAKING YOUR ANDROID DEVICE A CARDING WEAPON  NO BULLSHIT.  EASY TO SETUP  NO ROOTING YOUR PHONE NEEDED  ALL YOU DO IS DOWNLOAD A FEW APPS AND YOUR ON YOUR WAY TO MAKING SOME MONEY.  ENOUGH FAILING WITH YOUR GUIDES LETS MAKE SOME REAL MONEY$$,No refunds.,5.70 USD,2379 127 0,Comments (0),
hire a programmer,**Please let me know your project and I will create a separate listing for your order**  I can code frontend and backend of websites fast. I can create a .onion site and also clearnet site.  I know many programming language like Python  Javascript  Java C/C++/ C# I know also very good PHP  HTML  CSS  SQL and others.  I can create your site in 5 days  max 7 days.  Frontend and backend and if you want a .onion site like a market or a forum i can encrypt database and secure server and place also anti-DDos and Captcha to stay secure.  If you want a market i can create also the gateway for bitcoin payment or bitcoin address generator if you want a market like Empire Market.,No refund,570.00 USD,2094 195 1,Comments (0),
antidetect 7.3 + fraudfox vm + ccleanerpro,INSTANT DELIVERY TO YOUR INBOX  ANTI DETECT BROWSER  Anti detect is perhaps considered the best and secure browser in the world because of its many features including  ?BROWSER FINGERPRINT  WHAT IS A BROWSER FINGERPRINT?   Browsing fingerprinting is a term used to describe the collection of data to give a user  or client  a unique identifier. A simple example of data used to create unique fingerprints would be a user agent string. This data is often included in fullz profiles.  However  a browser fingerprint is not at all limited to user agent strings This is just one of many unique identifiers that can and will affect your transactions.  HOW DO WEBSITES USE FINGERPRINT  Other variables such as Flash version  keyboard layout  language settings  MIME settings  time zone  OS version  browser extensions  screen resolution  and many others are collected and organized to build profiles to verify the authenticity  of returning users. Companies such as MaxMind.,No refunds.,5.70 USD,2379 127 0,Comments (0),
burger king gift card generator + checker  workin,Burger King Gift Card Generator + Checker  Working 2023   Features: - Fully automatic. - Works world wide. - You can get store balance. - When you get a valid gift card it will show: Gift card number:Amount  Instructions for proper use: 1. Open the generator. 2. simply choose the amount of gift cards you would like to generate and press enter. it will automatically check if the gift cards are valid.,Burger King Gift Card Generator + Checker  Working 2021   Features: - Fully automatic. - Works world wide. - You can get store balance. - When you get a valid gift card it will show: Gift card number:Amount  Instructions for proper use: 1. Open the generator. 2. simply choose the amount of gift cards you would like to generate and press enter. it will automatically check if the gift cards are valid.,28.50 USD,4512 157 0,Comments (0),
showtime gift card generator + checker  working 2,SHOWTIME Gift Card Generator + Checker  Working 2023   Features: - Fully automatic. - Works world wide. - You can get store balance. - When you get a valid gift card it will show: Gift card number:Amount:PIN  Instructions for proper use: 1. Open the generator. 2. simply choose the amount of gift cards you would like to generate and press enter. it will automatically check if the gift cards are valid.,SHOWTIME Gift Card Generator + Checker  Working 2021   Features: - Fully automatic. - Works world wide. - You can get store balance. - When you get a valid gift card it will show: Gift card number:Amount:PIN  Instructions for proper use: 1. Open the generator. 2. simply choose the amount of gift cards you would like to generate and press enter. it will automatically check if the gift cards are valid.,28.50 USD,4512 157 0,Comments (0),
hulu plus gift card generator + checker  working,Hulu Plus Gift Card Generator + Checker  Working 2023   Features: - Fully automatic. - Works world wide. - You can get store balance. - When you get a valid gift card it will show: Gift card number:Amount  Instructions for proper use: 1. Open the generator. 2. simply choose the amount of gift cards you would like to generate and press enter. it will automatically check if the gift cards are valid.,Hulu Plus Gift Card Generator + Checker  Working 2021   Features: - Fully automatic. - Works world wide. - You can get store balance. - When you get a valid gift card it will show: Gift card number:Amount  Instructions for proper use: 1. Open the generator. 2. simply choose the amount of gift cards you would like to generate and press enter. it will automatically check if the gift cards are valid.,28.50 USD,4512 157 0,Comments (0),
nike gift card generator + checker  working 2023,Nike Gift Card Generator + Checker  Working 2023   Features: - Fully automatic. - Works world wide. - You can get store balance. - When you get a valid gift card it will show: Gift card number:Amount:PIN  Instructions for proper use: 1. Open the generator. 2. simply choose the amount of gift cards you would like to generate and press enter. it will automatically check if the gift cards are valid.,Nike Gift Card Generator + Checker  Working 2021   Features: - Fully automatic. - Works world wide. - You can get store balance. - When you get a valid gift card it will show: Gift card number:Amount:PIN  Instructions for proper use: 1. Open the generator. 2. simply choose the amount of gift cards you would like to generate and press enter. it will automatically check if the gift cards are valid.,28.50 USD,4512 157 0,Comments (0),
starbucks gift card generator + checker  working,Starbucks Gift Card Generator + Checker  Working 2023   Features: - Fully automatic. - Works world wide. - You can get store balance. - When you get a valid gift card it will show: Gift card number:Amount  Instructions for proper use: 1. Open the generator. 2. simply choose the amount of gift cards you would like to generate and press enter. it will automatically check if the gift cards are valid.,Starbucks Gift Card Generator + Checker  Working 2021   Features: - Fully automatic. - Works world wide. - You can get store balance. - When you get a valid gift card it will show: Gift card number:Amount  Instructions for proper use: 1. Open the generator. 2. simply choose the amount of gift cards you would like to generate and press enter. it will automatically check if the gift cards are valid.,28.50 USD,4512 157 0,Comments (1),k***********: The seller did not deliver the goods  and the contact did not respond  I was cheated
virgin airlines gift card generator + checker  wo,Virgin Airlines Gift Card Generator + Checker  Working 2023   Features: - Fully automatic. - Works world wide. - You can get store balance. - When you get a valid gift card it will show: Gift card number:Amount:PIN  Instructions for proper use: 1. Open the generator. 2. simply choose the amount of gift cards you would like to generate and press enter. it will automatically check if the gift cards are valid.,Virgin Airlines Gift Card Generator + Checker  Working 2021   Features: - Fully automatic. - Works world wide. - You can get store balance. - When you get a valid gift card it will show: Gift card number:Amount:PIN  Instructions for proper use: 1. Open the generator. 2. simply choose the amount of gift cards you would like to generate and press enter. it will automatically check if the gift cards are valid.,28.50 USD,4512 157 0,Comments (0),
apple gift card generator + checker  working 2023,Apple Gift Card Generator + Checker  Working 2023  Features: - Fully automatic. - Works world wide. - You can get store balance. - When you get a valid gift card it will show: Gift card number:Amount:Country  Instructions for proper use: 1. Open the generator. 2. simply choose the amount of gift cards you would like to generate and press enter. it will automatically check if the gift cards are valid.,Apple Gift Card Generator + Checker  Working 2021  Features: - Fully automatic. - Works world wide. - You can get store balance. - When you get a valid gift card it will show: Gift card number:Amount:Country  Instructions for proper use: 1. Open the generator. 2. simply choose the amount of gift cards you would like to generate and press enter. it will automatically check if the gift cards are valid.,28.50 USD,4512 157 0,Comments (0),
uber eats gift card generator + checker  working,Uber Eats Gift Card Generator + Checker  Working 2023   Features: - Fully automatic. - Works world wide. - You can get store balance. - When you get a valid gift card it will show: Gift card number:Amount  Instructions for proper use: 1. Open the generator. 2. simply choose the amount of gift cards you would like to generate and press enter. it will automatically check if the gift cards are valid.,Uber Eats Gift Card Generator + Checker  Working 2021   Features: - Fully automatic. - Works world wide. - You can get store balance. - When you get a valid gift card it will show: Gift card number:Amount  Instructions for proper use: 1. Open the generator. 2. simply choose the amount of gift cards you would like to generate and press enter. it will automatically check if the gift cards are valid.,28.50 USD,4512 157 0,Comments (0),
pinnacle studio ultimate 2023,--- Pinnacle Studio Ultimate 2023 ---- v. 23.2.1.297 WINDOWS   Release Date : 2023   Pinnacle Studio Ultimate delivers the tools you need to create pro-like videos  including premium effects from NewBlue FX. With powerful features like new Morph transitions  Split Screen video  Multi-Camera video editing and more  you can create HD and 4K videos with the controls  filters and precision you need to edit like a pro. Get the controls you need and go beyond what you thought possible with Pinnacle This program Pinnacle Studio Ultimate delivers the tools you need to create pro-like videos  including premium effects from NewBlueFX. This fully-loaded  advanced editing suite delivers unparalleled precision and control  along with MultiCam Capture and Split Screen video for a big-screen effect. Create HD and 4K videos with the controls  filters  and precision you need to edit like a pro  Complete description : textup.fr/466345vO,-,11.40 USD,2950 124 0,Comments (0),
netflix gift card generator + checker  working 20,Netflix Gift Card Generator + Checker  Working 2023  Features: - Fully automatic. - Works world wide. - You can get store balance. - When you get a valid gift card it will show: Gift card number:Amount:Country  Instructions for proper use: 1. Open the generator. 2. simply choose the amount of gift cards you would like to generate and press enter. it will automatically check if the gift cards are valid.,Netflix Gift Card Generator + Checker  Working 2021  Features: - Fully automatic. - Works world wide. - You can get store balance. - When you get a valid gift card it will show: Gift card number:Amount:Country  Instructions for proper use: 1. Open the generator. 2. simply choose the amount of gift cards you would like to generate and press enter. it will automatically check if the gift cards are valid.,28.50 USD,4512 157 0,Comments (0),
doordash gift card generator + checker  working 2,DoorDash Gift Card Generator + Checker  Working 2023   Features: - Fully automatic. - Works world wide. - You can get store balance. - When you get a valid gift card it will show: Gift card number:Amount:PIN  Instructions for proper use: 1. Open the generator. 2. simply choose the amount of gift cards you would like to generate and press enter. it will automatically check if the gift cards are valid.,DoorDash Gift Card Generator + Checker  Working 2021   Features: - Fully automatic. - Works world wide. - You can get store balance. - When you get a valid gift card it will show: Gift card number:Amount:PIN  Instructions for proper use: 1. Open the generator. 2. simply choose the amount of gift cards you would like to generate and press enter. it will automatically check if the gift cards are valid.,28.50 USD,4512 157 0,Comments (0),
best buy gift card generator + checker  working 2,Best Buy Gift Card Generator + Checker  Working 2023   Features: - Fully automatic. - Works world wide. - You can get store balance. - When you get a valid gift card it will show: Gift card number:Amount:PIN  Instructions for proper use: 1. Open the generator. 2. simply choose the amount of gift cards you would like to generate and press enter. it will automatically check if the gift cards are valid.,Best Buy Gift Card Generator + Checker  Working 2021   Features: - Fully automatic. - Works world wide. - You can get store balance. - When you get a valid gift card it will show: Gift card number:Amount:PIN  Instructions for proper use: 1. Open the generator. 2. simply choose the amount of gift cards you would like to generate and press enter. it will automatically check if the gift cards are valid.,28.50 USD,4512 157 0,Comments (0),
