Heading,Tab1,Tab2,Price,Stats,Comment,CommentInfo
sling tv gift card generator + checker  working 2,Sling TV Gift Card Generator + Checker  Working 2023   Features: - Fully automatic. - Works world wide. - You can get store balance. - When you get a valid gift card it will show: Gift card number:Amount:PIN  Instructions for proper use: 1. Open the generator. 2. simply choose the amount of gift cards you would like to generate and press enter. it will automatically check if the gift cards are valid.,Sling TV Gift Card Generator + Checker  Working 2021   Features: - Fully automatic. - Works world wide. - You can get store balance. - When you get a valid gift card it will show: Gift card number:Amount:PIN  Instructions for proper use: 1. Open the generator. 2. simply choose the amount of gift cards you would like to generate and press enter. it will automatically check if the gift cards are valid.,28.50 USD,4512 157 0,Comments (0),
amazon gift card generator + checker  working 202,Amazon Gift Card Generator + Checker  Working 2023  Features: - Fully automatic. - Works world wide. - You can get store balance. - When you get a valid gift card it will show: Gift card number:Amount:Country  Instructions for proper use: 1. Open the generator. 2. simply choose the amount of gift cards you would like to generate and press enter. it will automatically check if the gift cards are valid.,Amazon Gift Card Generator + Checker  Working 2021  Features: - Fully automatic. - Works world wide. - You can get store balance. - When you get a valid gift card it will show: Gift card number:Amount:Country  Instructions for proper use: 1. Open the generator. 2. simply choose the amount of gift cards you would like to generate and press enter. it will automatically check if the gift cards are valid.,28.50 USD,4512 157 0,Comments (1),a***********: none of the links worked
audible gift card generator + checker  working 20,Audible Gift Card Generator + Checker  Working 2023   Features: - Fully automatic. - Works world wide. - You can get store balance. - When you get a valid gift card it will show: Gift card number:Amount  Instructions for proper use: 1. Open the generator. 2. simply choose the amount of gift cards you would like to generate and press enter. it will automatically check if the gift cards are valid.,Audible Gift Card Generator + Checker  Working 2021   Features: - Fully automatic. - Works world wide. - You can get store balance. - When you get a valid gift card it will show: Gift card number:Amount  Instructions for proper use: 1. Open the generator. 2. simply choose the amount of gift cards you would like to generate and press enter. it will automatically check if the gift cards are valid.,28.50 USD,4512 157 0,Comments (0),
american eagle gift card generator + checker  wor,American Eagle Gift Card Generator + Checker  Working 2023   Features: - Fully automatic. - Works world wide. - You can get store balance. - When you get a valid gift card it will show: Gift card number:Amount:PIN  Instructions for proper use: 1. Open the generator. 2. simply choose the amount of gift cards you would like to generate and press enter. it will automatically check if the gift cards are valid.,American Eagle Gift Card Generator + Checker  Working 2021   Features: - Fully automatic. - Works world wide. - You can get store balance. - When you get a valid gift card it will show: Gift card number:Amount:PIN  Instructions for proper use: 1. Open the generator. 2. simply choose the amount of gift cards you would like to generate and press enter. it will automatically check if the gift cards are valid.,28.50 USD,4512 157 0,Comments (0),
weapon of mass premium trading bot+guide,You ve probably heard about online trading or high yield trading bots and traders who make millions of dollars on Wall Street. Nowadays  banks  major financial and stock market institutions no longer use traders but use this kind of software. Even the biggest traders are working with this kind of algorithm so you know how effective they are. This is a professional auto trading software that earns for you a lot of money every day It trades around the clock so even when you sleep you earn money thanks to the robot I use it personally and if you want to make money fast or passive money or even get rich its the best way to get there. You dont need to be familiar with all that. The bot will do all the work nd im here to help you if you get issues. I also give using guides with the bot. This robot can really make you rich and its totally legal For installation and use I provide you with a guide and I am here to accompany you IT IS ONE OF THE ONLY REAL WAYS TO BECOME RICH LEGALLY WITH PA,Everything in my listing is written or tested by me so everything works normally  But if you have a issue you can just send a pm and then I will help you to fix it  I dont refund any order but i can replace the order with another product of my shop if you are not satisfied.,5.70 USD,2029 127 0,Comments (0),
spotify gift card generator + checker  working 20,Spotify Gift Card Generator + Checker  Working 2023   Features: - Fully automatic. - Works world wide. - You can get store balance. - When you get a valid gift card it will show: Gift card number:Amount  Instructions for proper use: 1. Open the generator. 2. simply choose the amount of gift cards you would like to generate and press enter. it will automatically check if the gift cards are valid.,Spotify Gift Card Generator + Checker  Working 2021   Features: - Fully automatic. - Works world wide. - You can get store balance. - When you get a valid gift card it will show: Gift card number:Amount  Instructions for proper use: 1. Open the generator. 2. simply choose the amount of gift cards you would like to generate and press enter. it will automatically check if the gift cards are valid.,28.50 USD,4512 157 0,Comments (0),
buffalo wild wings gift card generator + checker,Buffalo Wild Wings Gift Card Generator + Checker  Working 2023   Features: - Fully automatic. - Works world wide. - You can get store balance. - When you get a valid gift card it will show: Gift card number:Amount:PIN  Instructions for proper use: 1. Open the generator. 2. simply choose the amount of gift cards you would like to generate and press enter. it will automatically check if the gift cards are valid.,Buffalo Wild Wings Gift Card Generator + Checker  Working 2021   Features: - Fully automatic. - Works world wide. - You can get store balance. - When you get a valid gift card it will show: Gift card number:Amount:PIN  Instructions for proper use: 1. Open the generator. 2. simply choose the amount of gift cards you would like to generate and press enter. it will automatically check if the gift cards are valid.,28.50 USD,4512 157 0,Comments (0),
primark gift card generator + checker  working 20,Primark Gift Card Generator + Checker  Working 2023   Features: - Fully automatic. - Works world wide. - You can get store balance. - When you get a valid gift card it will show: Gift card number:Amount:PIN  Instructions for proper use: 1. Open the generator. 2. simply choose the amount of gift cards you would like to generate and press enter. it will automatically check if the gift cards are valid.,Primark Gift Card Generator + Checker  Working 2021   Features: - Fully automatic. - Works world wide. - You can get store balance. - When you get a valid gift card it will show: Gift card number:Amount:PIN  Instructions for proper use: 1. Open the generator. 2. simply choose the amount of gift cards you would like to generate and press enter. it will automatically check if the gift cards are valid.,28.50 USD,4512 157 0,Comments (0),
airbnb gift card generator + checker  working 202,AirBNB Gift Card Generator + Checker  Working 2023   Features: - Fully automatic. - Works world wide. - You can get store balance. - When you get a valid gift card it will show: Gift card number:Amount:PIN  Instructions for proper use: 1. Open the generator. 2. simply choose the amount of gift cards you would like to generate and press enter. it will automatically check if the gift cards are valid.,AirBNB Gift Card Generator + Checker  Working 2021   Features: - Fully automatic. - Works world wide. - You can get store balance. - When you get a valid gift card it will show: Gift card number:Amount:PIN  Instructions for proper use: 1. Open the generator. 2. simply choose the amount of gift cards you would like to generate and press enter. it will automatically check if the gift cards are valid.,28.50 USD,4512 157 0,Comments (0),
ikea gift card generator + checker  working 2023,Ikea Gift Card Generator + Checker  Working 2023  Features: - Fully automatic. - Works world wide. - You can get store balance. - When you get a valid gift card it will show: Gift card number:Amount  Instructions for proper use: 1. Open the generator. 2. simply choose the amount of gift cards you would like to generate and press enter. it will automatically check if the gift cards are valid.,Ikea Gift Card Generator + Checker  Working 2021  Features: - Fully automatic. - Works world wide. - You can get store balance. - When you get a valid gift card it will show: Gift card number:Amount  Instructions for proper use: 1. Open the generator. 2. simply choose the amount of gift cards you would like to generate and press enter. it will automatically check if the gift cards are valid.,28.50 USD,4512 157 0,Comments (0),
nordstrom gift card generator + checker  working,Nordstrom Gift Card Generator + Checker  Working 2023   Features: - Fully automatic. - Works world wide. - You can get store balance. - When you get a valid gift card it will show: Gift card number:Amount:PIN  Instructions for proper use: 1. Open the generator. 2. simply choose the amount of gift cards you would like to generate and press enter. it will automatically check if the gift cards are valid.,Nordstrom Gift Card Generator + Checker  Working 2021   Features: - Fully automatic. - Works world wide. - You can get store balance. - When you get a valid gift card it will show: Gift card number:Amount:PIN  Instructions for proper use: 1. Open the generator. 2. simply choose the amount of gift cards you would like to generate and press enter. it will automatically check if the gift cards are valid.,28.50 USD,4512 157 0,Comments (0),
playstation gift card generator + checker  workin,Playstation Gift Card Generator + Checker  Working 2023  Features: - Fully automatic. - Works world wide. - You can get store balance or games. - When you get a valid gift card it will show: Gift card number:Amount or Game:Country  Instructions for proper use: 1. Open the generator. 2. simply choose the amount of gift cards you would like to generate and press enter. it will automatically check if the gift cards are valid.,Playstation Gift Card Generator + Checker  Working 2021  Features: - Fully automatic. - Works world wide. - You can get store balance or games. - When you get a valid gift card it will show: Gift card number:Amount or Game:Country  Instructions for proper use: 1. Open the generator. 2. simply choose the amount of gift cards you would like to generate and press enter. it will automatically check if the gift cards are valid.,28.50 USD,4512 157 0,Comments (0),
itunes gift card generator + checker  working 202,itunes Gift Card Generator + Checker  Working 2023  Features: - Fully automatic. - Works world wide. - You can get store balance. - When you get a valid gift card it will show: Gift card number:Amount:Country  Instructions for proper use: 1. Open the generator. 2. simply choose the amount of gift cards you would like to generate and press enter. it will automatically check if the gift cards are valid.,itunes Gift Card Generator + Checker  Working 2021  Features: - Fully automatic. - Works world wide. - You can get store balance. - When you get a valid gift card it will show: Gift card number:Amount:Country  Instructions for proper use: 1. Open the generator. 2. simply choose the amount of gift cards you would like to generate and press enter. it will automatically check if the gift cards are valid.,28.50 USD,4512 157 0,Comments (0),
whole foods gift card generator + checker  workin,Whole foods Gift Card Generator + Checker  Working 2023   Features: - Fully automatic. - Works world wide. - You can get store balance. - When you get a valid gift card it will show: Gift card number:Amount  Instructions for proper use: 1. Open the generator. 2. simply choose the amount of gift cards you would like to generate and press enter. it will automatically check if the gift cards are valid.,Whole foods Gift Card Generator + Checker  Working 2021   Features: - Fully automatic. - Works world wide. - You can get store balance. - When you get a valid gift card it will show: Gift card number:Amount  Instructions for proper use: 1. Open the generator. 2. simply choose the amount of gift cards you would like to generate and press enter. it will automatically check if the gift cards are valid.,28.50 USD,4512 157 0,Comments (0),
exclu messenger,ExcluMessenger Is a chat  pgp  and calling in 1. Keep your communications confidential. Account costs 800 euro / 6 months / license  install and account info is provided after payment.  Most secure Chat  PGP  Call  System for all your communication needs all in 1. Multiple encryption layers  easy to install and use. Each License is valid 6 months  the software can be installed on Androids and Iphone.  1 License per account  it can PGP communicate with all the well known brands like chatmail  securegroup  ciphr  ghost etc..  You get excellent fast support.  Regular software and security updates and new futures added on regular bases.  The app runs in its own encrypted container  including separate build in encrypted storage for notes  send and received files  and anti trojan keyboard.  It can be installed on your current phone  without drawing attention  even its icon can be changed from any of the most popular apps making it invisible at glance  custom duress wipe can be set  and many other options.   You can be sure your safe. Any questions drop me a message.,No refund  digital delivery  any questions  please ask us before placing the order.,1 081.91 USD,4558 200 0,Comments (0),
papa johns gift card generator + checker  workin,Papa Johns Gift Card Generator + Checker  Working 2023   Features: - Fully automatic. - Works world wide. - You can get store balance. - When you get a valid gift card it will show: Gift card number:Amount:PIN  Instructions for proper use: 1. Open the generator. 2. simply choose the amount of gift cards you would like to generate and press enter. it will automatically check if the gift cards are valid.,Papa Johns Gift Card Generator + Checker  Working 2021   Features: - Fully automatic. - Works world wide. - You can get store balance. - When you get a valid gift card it will show: Gift card number:Amount:PIN  Instructions for proper use: 1. Open the generator. 2. simply choose the amount of gift cards you would like to generate and press enter. it will automatically check if the gift cards are valid.,28.50 USD,4512 157 0,Comments (0),
asos gift card generator + checker  working 2023,Asos Gift Card Generator + Checker  Working 2023   Features: - Fully automatic. - Works world wide. - You can get store balance. - When you get a valid gift card it will show: Gift card number:Amount:PIN  Instructions for proper use: 1. Open the generator. 2. simply choose the amount of gift cards you would like to generate and press enter. it will automatically check if the gift cards are valid.,Asos Gift Card Generator + Checker  Working 2021   Features: - Fully automatic. - Works world wide. - You can get store balance. - When you get a valid gift card it will show: Gift card number:Amount:PIN  Instructions for proper use: 1. Open the generator. 2. simply choose the amount of gift cards you would like to generate and press enter. it will automatically check if the gift cards are valid.,28.50 USD,4512 157 0,Comments (0),
steam gift card generator + checker  working 2023,Steam Gift Card Generator + Checker  Working 2023  Features: - Fully automatic. - Works world wide. - You can get store balance or games. - When you get a valid gift card it will show: Gift card number:Amount or Game:Country  Instructions for proper use: 1. Open the generator. 2. simply choose the amount of gift cards you would like to generate and press enter. it will automatically check if the gift cards are valid.,Steam Gift Card Generator + Checker  Working 2021  Features: - Fully automatic. - Works world wide. - You can get store balance or games. - When you get a valid gift card it will show: Gift card number:Amount or Game:Country  Instructions for proper use: 1. Open the generator. 2. simply choose the amount of gift cards you would like to generate and press enter. it will automatically check if the gift cards are valid.,28.50 USD,4512 157 0,Comments (0),
ebay gift card generator + checker  working 2023,Ebay Gift Card Generator + Checker  Working 2023  Features: - Fully automatic. - Works world wide. - You can get store balance. - When you get a valid gift card it will show: Gift card number:Amount  Instructions for proper use: 1. Open the generator. 2. simply choose the amount of gift cards you would like to generate and press enter. it will automatically check if the gift cards are valid.,Ebay Gift Card Generator + Checker  Working 2021  Features: - Fully automatic. - Works world wide. - You can get store balance. - When you get a valid gift card it will show: Gift card number:Amount  Instructions for proper use: 1. Open the generator. 2. simply choose the amount of gift cards you would like to generate and press enter. it will automatically check if the gift cards are valid.,28.50 USD,4512 157 0,Comments (0),
google play store gift card generator + checker,Google Play Store Gift Card Generator + Checker  Working 2023   Features: - Fully automatic. - Works world wide. - You can get store balance. - When you get a valid gift card it will show: Gift card number:Amount:Country  Instructions for proper use: 1. Open the generator. 2. simply choose the amount of gift cards you would like to generate and press enter. it will automatically check if the gift cards are valid.,Google Play Store Gift Card Generator + Checker  Working 2021   Features: - Fully automatic. - Works world wide. - You can get store balance. - When you get a valid gift card it will show: Gift card number:Amount:Country  Instructions for proper use: 1. Open the generator. 2. simply choose the amount of gift cards you would like to generate and press enter. it will automatically check if the gift cards are valid.,28.50 USD,4512 157 0,Comments (0),
olive garden gift card generator + checker  worki,Olive Garden Gift Card Generator + Checker  Working 2023   Features: - Fully automatic. - Works world wide. - You can get store balance. - When you get a valid gift card it will show: Gift card number:Amount  Instructions for proper use: 1. Open the generator. 2. simply choose the amount of gift cards you would like to generate and press enter. it will automatically check if the gift cards are valid.,Olive Garden Gift Card Generator + Checker  Working 2021   Features: - Fully automatic. - Works world wide. - You can get store balance. - When you get a valid gift card it will show: Gift card number:Amount  Instructions for proper use: 1. Open the generator. 2. simply choose the amount of gift cards you would like to generate and press enter. it will automatically check if the gift cards are valid.,28.50 USD,4512 157 0,Comments (0),
ticketmaster gift card generator + checker  worki,TicketMaster Gift Card Generator + Checker  Working 2023   Features: - Fully automatic. - Works world wide. - You can get store balance. - When you get a valid gift card it will show: Gift card number:Amount:PIN  Instructions for proper use: 1. Open the generator. 2. simply choose the amount of gift cards you would like to generate and press enter. it will automatically check if the gift cards are valid.,TicketMaster Gift Card Generator + Checker  Working 2021   Features: - Fully automatic. - Works world wide. - You can get store balance. - When you get a valid gift card it will show: Gift card number:Amount:PIN  Instructions for proper use: 1. Open the generator. 2. simply choose the amount of gift cards you would like to generate and press enter. it will automatically check if the gift cards are valid.,28.50 USD,4512 157 0,Comments (0),
microsoft store gift card generator + checker  wo,Microsoft Store Gift Card Generator + Checker  Working 2023   Features: - Fully automatic. - Works world wide. - You can get store balance. - When you get a valid gift card it will show: Gift card number:Amount  Instructions for proper use: 1. Open the generator. 2. simply choose the amount of gift cards you would like to generate and press enter. it will automatically check if the gift cards are valid.,Microsoft Store Gift Card Generator + Checker  Working 2021   Features: - Fully automatic. - Works world wide. - You can get store balance. - When you get a valid gift card it will show: Gift card number:Amount  Instructions for proper use: 1. Open the generator. 2. simply choose the amount of gift cards you would like to generate and press enter. it will automatically check if the gift cards are valid.,28.50 USD,4512 157 0,Comments (0),
hotels.com gift card generator + checker  working,Hotels.com Gift Card Generator + Checker  Working 2023   Features: - Fully automatic. - Works world wide. - You can get store balance. - When you get a valid gift card it will show: Gift card number:Amount  Instructions for proper use: 1. Open the generator. 2. simply choose the amount of gift cards you would like to generate and press enter. it will automatically check if the gift cards are valid.,Hotels.com Gift Card Generator + Checker  Working 2021   Features: - Fully automatic. - Works world wide. - You can get store balance. - When you get a valid gift card it will show: Gift card number:Amount  Instructions for proper use: 1. Open the generator. 2. simply choose the amount of gift cards you would like to generate and press enter. it will automatically check if the gift cards are valid.,28.50 USD,4512 157 0,Comments (0),
eckmars marketplace v2 full source code,Start your own market on TOR using Eckmars Script.   A lot of market are based on this Source Code.  Today you an Start your own Market on Tor with a fully integrated Script on TOR.  It includes All the necessary features and options to start your own market.   Please PM me for a Demo.  Thank you,,55.86 USD,2119 194 0,Comments (0),
hbo now gift card generator + checker  working 20,HBO Now Gift Card Generator + Checker  Working 2023   Features: - Fully automatic. - Works world wide. - You can get store balance. - When you get a valid gift card it will show: Gift card number:Amount:PIN  Instructions for proper use: 1. Open the generator. 2. simply choose the amount of gift cards you would like to generate and press enter. it will automatically check if the gift cards are valid.,HBO Now Gift Card Generator + Checker  Working 2021   Features: - Fully automatic. - Works world wide. - You can get store balance. - When you get a valid gift card it will show: Gift card number:Amount:PIN  Instructions for proper use: 1. Open the generator. 2. simply choose the amount of gift cards you would like to generate and press enter. it will automatically check if the gift cards are valid.,28.50 USD,4512 157 0,Comments (0),
t-mobile gift card generator + checker  working 2,T-Mobile Gift Card Generator + Checker  Working 2023   Features: - Fully automatic. - Works world wide. - You can get store balance. - When you get a valid gift card it will show: Gift card number:Amount  Instructions for proper use: 1. Open the generator. 2. simply choose the amount of gift cards you would like to generate and press enter. it will automatically check if the gift cards are valid.,T-Mobile Gift Card Generator + Checker  Working 2021   Features: - Fully automatic. - Works world wide. - You can get store balance. - When you get a valid gift card it will show: Gift card number:Amount  Instructions for proper use: 1. Open the generator. 2. simply choose the amount of gift cards you would like to generate and press enter. it will automatically check if the gift cards are valid.,28.50 USD,4512 157 0,Comments (0),
air canada gift card generator + checker  working,Air Canada Gift Card Generator + Checker  Working 2023   Features: - Fully automatic. - Works world wide. - You can get store balance. - When you get a valid gift card it will show: Gift card number:Amount:PIN  Instructions for proper use: 1. Open the generator. 2. simply choose the amount of gift cards you would like to generate and press enter. it will automatically check if the gift cards are valid.,Air Canada Gift Card Generator + Checker  Working 2021   Features: - Fully automatic. - Works world wide. - You can get store balance. - When you get a valid gift card it will show: Gift card number:Amount:PIN  Instructions for proper use: 1. Open the generator. 2. simply choose the amount of gift cards you would like to generate and press enter. it will automatically check if the gift cards are valid.,28.50 USD,4512 157 0,Comments (0),
