Heading,Tab1,Tab2,Price,Stats,Comment,CommentInfo
fresh usa pnc bank drop + email + phone + debit,FRESH USA PNC BANK DROP + EMAIL ACCESS + PHONE ACCESS + DEBIT CARD + ZELLE  UPON ORDERING YOU WILL RECEIVE: -BANK DROP USER AND PASS -EMAIL ACCESS USER AND PASS -PHONE ACCESS USER AND PASS -FULLZ (NAME  ADDRESS  DOB  SSN),**PLEASE READ** REFUND AND REPLACEMENT POLICY: REFUNDS AND REPLACEMENTS  ARE NOT AVAILABLE FOR THIS LISTING. BY PURCHASING THIS LISTING  YOU AGREE AND CONSENT TO THE REFUND AND REPLACEMENT POLICY.  ALL SALES ARE FINAL.,91.20 USD,2052 198 0,Comments (0),
complete set of five (5) italian bankdrop  fresh,Hello Darkoders  Here we sell a complete fresh SET of Bank Drops. The SET it's made by 5 Bank drops + complete identity.  Included: FIVE ( 5 )Italian Bank accounts Complete ID: ID card Proof of address Tax Code Picture Selfie with ID Selfie with ID + Paper Sim Card Phone Connected to the account  Plus a list of exchanger that you can easy verify with such ID set.,We check everything before delivery. But In case of problems before use we will provide full refund.,1 026.00 USD,2137 196 0,Comments (0),
chime drop bank (fullz  gmail  google voice  vcc),This is self-made account (registered with bot so was never accessed by human).  If you need physical card its possible to change address and ship to your own address.  We never access goods we sell so you will be the only owner and you can use any preset you comfortable (no need in user-agent string spoofing etc). VCC number and AN/RN data not provided so you can  found it inside account yourself if needed.  Example:  First Name		 Last Name		 Address			 City			 State			 ZIP			 DOB			 SSN			  ==========================================================================			 Gmail and Google Voice			 Login			 Password			 Recovery			 Phone			  ==========================================================================			 chime.com			 Login			 Password,Refund policy: No refunds or replacements until there is no other conditions in listings. I just cant be sure that you use my stuff properly even if you have 10+ years in carding (dns or ip leakage  others raised flags  useragent etc.  even quottoo fast professional clickingquot may ruin all your work) All refunds or replacements optional and I just can say NO. I am not responsible for your decisions and how you use my stuff  also I am not responsible for quality (I always try my BEST but I cannot guarantee nothing since this is all stolen/leaked data). I am here for the long run and I want to make a good image about myself. Negative feedback before trying to resolve your problem in PM would case permanently ban in my store. We are all people and if you dissatified please be rational and dont start holy war If you dont know how to use my stuff properly but want to test it anyways. Sometimes we are all have bad days. I try to ship fast but it can be up to 48 hours,17.10 USD,1340 152 0,Comments (0),
hq german volksbank bd,HQ German Bank Drop Volksbank  - Girocard - Online Banking - Sealed Pins,Please check your adress,175.81 USD,1342 198 0,Comments (0),
bank drop tutorial - how to make bank drop account,Bank Drop Tutorial - How To Make Bank Drop Account 2023 ! Fresh tutorial (TESTED) !  You will learn : How to make bank drop Encrypt your files And many more !   NOTE: I do not sell with so low prices because i got this tutorial by hard  My Shop Feature's: -Fast Response  -Fresh And Tested Items  -100 % Guarantee Items And Tutorials Works Perfectly -High Quality Products -Leave A Good Feedback And Choose One Of My Products For FREE !,DONT ASK FOR REPLACEMENT WITHOUT PROOF (upload video proof at mega.nz server and send us link for download.) I am not Responsible if you used it wrong and got your ip blocked from banks  Please Learn The Tutorial Carefully Before Telling Me That The Method Isn't Working Anymore,22.80 USD,1965 155 0,Comments (0),
bank drop tutorial - how to make bank drop account clone,Bank Drop Tutorial - How To Make Bank Drop Account 2023 ! Fresh tutorial (TESTED) !  You will learn : How to make bank drop Encrypt your files And many more !   NOTE: I do not sell with so low prices because i got this tutorial by hard  My Shop Feature's: -Fast Response  -Fresh And Tested Items  -100 % Guarantee Items And Tutorials Works Perfectly -High Quality Products -Leave A Good Feedback And Choose One Of My Products For FREE !,DONT ASK FOR REPLACEMENT WITHOUT PROOF (upload video proof at mega.nz server and send us link for download.) I am not Responsible if you used it wrong and got your ip blocked from banks  Please Learn The Tutorial Carefully Before Telling Me That The Method Isn't Working Anymore,22.80 USD,4943 156 0,Comments (0),
uk rbs and natwest cheques/checks,NOTICE: If you would like to buy the method  please message us. We sell the method at 80 GBP.  This is our first batch so were giving them out at a low price  We are providing REAL UK company cheques. These are not fake cheques like other vendors are providing. These cheques are either RBS or NatWest and have been obtained through an accounting company.  These cheques have worked well with our private UK clients and have been known to work well when been handed into a bank or business on a Monday.  The cheques will be blank but 90% of the cheques have already been signed by a company director  if you would like a cheque that has not been signed please let us know in the buyer notes. Also please let us know if you would like an RBS or NatWest cheque  if you do not let us know  we will presume that any will be fine. We are not certain if these cheques are blocked but most of our private clients have been successful with these cheques.,REFUNDS AND RESHIPS ARE COMPLETELY DISCRETIONARY.  Building strong and lasting relationships with our customers is important to us. Sometimes things can go wrong and when this happens we encourage customers to contact us about it so we can aim to put things right.  We have a 99% delivery success rate domestically and 98% internationally  so it is very unlikely that your order will go missing but problems due occur so we have a firm but fair refund/reship policy.  We do aim for next day delivery,84.36 USD,18740 136 31,Comments (0),
keybank logs with random balance perfect for ach,keybank logs with random balance perfect for ach transfers,hi guys   available (LIMITED AVAILABILITY   FIRST COME   FIRST SERVE ) hacked keybank logs WITH FULL AN and FULL RN perfect for ach transfer   you will make a killing with it  + ACH transfer tutorial  NB : i will send you tutorial for free (many vendors selling only account log   once you finalize your order i will send you tutorial for free   NB : im selling as it is   balance can be 1$ or 1 million dollar   IM NOT RESPONSIBLE FOR YOUR CASHOUT FAILURE   I WILL ONLY SELL YOU GUARANTEED LOGIN 100%   do your own research   there is many ways to cashout   you need to train   you can make millions with these accounts,4.55 USD,4445 134 0,Comments (0),
ultimate bank drop setup and explanation guide,HELLO VIEWERS... GOOD NEWS IS ONE OF THE MOST COMPLETE  POPULAR &amp; EASY TO FOLLOW BANK DROP SETUP GUIDE. INDIVIDUAL SETUP GUIDES FOR LEADING NINE US BANKS.   UPON READING THIS TUTORIAL  NOT ONLY YOU WOULD ABLE TO SETUP BANK DROPS WITH HIGHER SUCCESS RATES  BUT ALSO YOU COULD DO IT SECURELY WITH NO TRACE!!  What exactly is a bank drop and why are they essential to our success when it comes to bank fraud? I will get in-depth into this topic and explain to you in plain English words  so you can fully understand why we need bank drops. When we are conducting any type of illegal business  our one goal is to make a profit. And to make a profit  we need to have not only the proper OPSEC so we dont get caught by the police  but we need a safe way to get the dirty funds into our hands so we can later spend/clean or do whatever you so wish with them. Bank drops are the solution to that specific problem. Bank drops are bank accounts that are opened specifically for the purpose of storing your dirty funds. Once you open them  you can decide whether you wish to withdraw the funds directly from the account as cash by going to the bank ATM  or possibly clean them with specific methods  and only after cleaning them  cashing them out (my preferred method and much safer).   BANKING MADE SIMPLE BANK DROP MADE SIMPLE BANK DROP OPSEC SETUP ACQUIRING FULLZ FOR BANK DROPS BANK DROP CREATION &amp; SETUP  FIRST LINES US BANKS GUIDE BANK DROP AGING CASHING OUT BANK DROP VENDORS &amp; RESOURCES CONCLUSION,No Refund. Replace if link is not working!,14.25 USD,2395 156 0,Comments (2),d******: good infos********: Excellent guide! Very useful
$2752 ultimate poker cc cashout works worldwide,INSTANT  DELIVERY TO YOUR INBOX  If you are searching for a carding method that:  -Cant get burned -Its all virtual -Makes you super rich  This guide will teach you how to cashout while anywhere in the world using gambling and poker Method involves carding and cashing out easy.,No refunds.,5.70 USD,1873 124 0,Comments (0),
guide cc/cvv to gift cards including video,INSTANT DELIVERY TO YOUR INBOX Latest guides and videos on how to CASHOUT to gift cards! This is a pack of multiple guides on gift carding and a list of easily cardable websites to go with it.,No refunds.,5.70 USD,1873 124 0,Comments (0),
easy cardable low security website list 10 000,INSTANT DELIVERY TO YOUR INBOX  THIS LIST OF 10000 SITES WILL KEEP YOU BUSY FOR A LONG TIME.  STOP FAILING AT THE MAJOR BULLSHIT SITES AND START WHERE THE PROS DO.    CHECK OUT THE REST OF MY DIGITAL DISCOUNT MEGA STORE FOR MORE DEALS ON EVERYTHING DIGITAL AND THE BEST PRICES ON THE DARK-WEB MARKETS. GUARANTEE!,No refunds.,5.70 USD,1873 124 0,Comments (0),
paypal latest guide cc/cvv to btc v2.0,★★★INSTANT DELIVERY TO YOUR INBOX★★★  This is an in depth guide on turning a paypal account to bitcoin.  Many bitcoin selling exchange accept paypal now.,No refunds.,5.70 USD,1873 124 0,Comments (0),
usa/uk/can/aus/bel/pol virtual phone number,USA/UK/CANADIAN/AUSTRALIAN/BELGIAN/POLISH VIRTUAL PHONE NUMBER PAID IN BTC To verify any account  How to get virtual phone number paid in bitcoin to send and receive sms INSTANT DELIVERY  I will give you a link to a website where you can buy in btc USA/UK/CANADIAN/AUSTRALIAN/BELGIAN/POLISH virtual phone numbers  You can verify any account with these numbers (ebay paypal bank exchangers amazon localbitcoins skrill)  Unique numbers NON blacklisted  Totally anonymous  No Apps needed  Send sms at cheap rates and receive for free  LINK TO WEBSITE ONLY   Once you put positive feedback please message me i will send you a wonderful gift to make huge money,If any problem please kindly message me we will fix it   please note that i receive more than 300 messages daily   its very difficult for me to answer quickly  Once you put positive feedback please message me i will send you a wonderful gift to make huge money,39.90 USD,1870 147 0,Comments (0),
make big money on darkmarkets become vendor guide,INSTANT  DELIVERY TO YOUR INBOX  How to make BIG MONEY on DARKMARKETS 100% WORKING  NO BULLSHIT  step by step guide.  You will learn to sell guides and tutorials in the dark market. I have more than $ 500 a day and sometimes much more using this method. It is easy ... Stop working and get a better life. Easy money for all. Noob friendly.  No long boring lectures here. All I will tell you is this  if you’re the type who feels taking from others is immoral  wrong  harsh  etc  then this isn’t for you. Your best bet is to look for a 9 to 5 or offer your services to a church and don’t bother to reading on.,No refunds.,5.70 USD,1873 124 0,Comments (0),
amazon refund guide - extremely detailed,INSTANT DELIVERY TO YOUR INBOX  This guide contains all the knowledge you need to successfully rape amazon and never be caught  and what you do with this knowledge  is entirely up to you. This guide was written on years of experience and some of the information you will read was provided by an ex amazon employee and his name will be provided next to it.,No refunds.,5.70 USD,1873 124 0,Comments (0),
antidetect 7.3 + fraudfox vm +4000configs 2023,INSTANT DELIVERY TO YOUR INBOX  ANTI DETECT BROWSER  Anti detect is perhaps considered the best and secure browser in the world because of its many features including  ?BROWSER FINGERPRINT  WHAT IS A BROWSER FINGERPRINT?   Browsing fingerprinting is a term used to describe the collection of data to give a user  or client  a unique identifier. A simple example of data used to create unique fingerprints would be a user agent string. This data is often included in fullz profiles.  However  a browser fingerprint is not at all limited to user agent strings This is just one of many unique identifiers that can and will affect your transactions.  HOW DO WEBSITES USE FINGERPRINT  Other variables such as Flash version  keyboard layout  language settings  MIME settings  time zone  OS version  browser extensions  screen resolution  and many others are collected and organized to build profiles to verify the authenticity  of returning users. Companies such as MaxMind  SAS  and ProScore s,No refunds.,5.70 USD,1873 124 0,Comments (0),
one click mac address changer,INSTANT  DELIVERY TO YOUR INBOX    This is the easiest and most effective Mac Address changer on the market.,No refunds.,5.70 USD,1873 124 0,Comments (0),
custom listing for transfers,Here is a custom listing for 10 000 usd transfer to EU   Is wire a transfer   Policy I will not refund or replace if the account has any fraudulent issue   Terms and conditions of Hackchain  As soon as my main business selling logs I staying online every day. Anyway leaving prior notice in case my unavailability. Shipment time usually within 24 hours or faster in case i'm not sleeping.,Here is a custom listing for 10 000 usd transfer to EU   Is wire a transfer   Policy I will not refund or replace if the account has any fraudulent issue   Terms and conditions of Hackchain  As soon as my main business selling logs I staying online every day. Anyway leaving prior notice in case my unavailability. Shipment time usually within 24 hours or faster in case i'm not sleeping.,74.10 USD,2103 196 0,Comments (0),
one click mac address changer,INSTANT  DELIVERY TO YOUR INBOX    This is the easiest and most effective Mac Address changer on the market.,No refunds.,5.70 USD,1873 124 0,Comments (1),g*************: Perfect!!
watch me cashout credit card in front of you,INSTANT DELIVERY TO YOUR INBOX  Watch me cashing out CC right in front of your eyes.  COPY ME and make some   Don t BUY crap outdated guides  get a real VIDEO TUTORIAL and never look back    Probably many PRO carders know this method but they DONT want you to know it because its a REAL CASH MACHINE   Video content:  1 Checking socks if blacklisted  2 Carding 3 Getting pure 1000 in bitcoins in 1hr  5 Rinse and repeat    NOTE :  The site that i card in the VIDEO is down because it has been cashed out BUT i will give exact hint how to find new sites  they are plenty on the web   You will WOUCH me GUARANTEEEED,No refunds.,5.70 USD,1873 124 0,Comments (0),
85 000 items fraud bible 36gb,INSTANT  DELIVERY TO YOUR INBOX  This is the largest pack on the market currently.  You will not find a better deal anywhere else I guarantee it.  This has everything you would ever need to become a pro carder or pro hacker plus thousands of scans and templates.    CONTENTS: ANTIDETECT 7.0 550 MSRP + FRAUDFOX VM  https://www.antidetect.org. Never fail at carding again  and never burn another card.  Every Pro Carder has this program  its a must. This will increase your CARDING success rate to 98-100% during CC  PAYPAL  EBAY  AMAZON  BANK CARDING ETC.  This program allows you to change browser type  version  language  user agent  Adobe flash version  types of plugins  OS   Processor type  time zone and screen resolution so to avoid browser fingerprinting and detection  3 QUALITY VPNs AND PROXY  VPNs are great for accessing blocked websites or for browsing in complete anonymity  bypassing Internet filters  and making your IP address the same address of the cc/cvv or Fullz i,No refunds.,5.70 USD,1873 124 0,Comments (0),
uber fraud pack make $2500 monthly,INSTANT DELIVERY TO YOUR INBOX   This is VERY EASY to do and use and Replicate so you can literally retire if you have enough accounts getting paid.  This quick and complete guide explains you how to cashout credit cards trough an easy processor.  What is needed to use the method? A solid Bank Drop Rooted Phone Or Android Emulators Created or Hacked Uber accounts   What we will be doing?  We will be using social engineering to get an approved google driver account  then fake rides and get payments into our bank account.  Works in all countries where Uber is.  WORLDWIDE WORKING  You will get these Guides:  Free Rides System  Get Free Rides FOREVER. Hack Ubers Driver System Make thousands Being a Fake UBER DRIVER Use this guide to easily trick Uber into paying you to be a driver while actually not leaving our home Unlimited Uber rides  you will learn how to get free unlimited UBER rides as well.,No refunds.,5.70 USD,1873 124 0,Comments (0),
print usps/fedex/canada post labels anonymous,★★★INSTANT DELIVERY TO YOUR INBOX★★★  -Dhl is also sometimes available  If you are looking for printed labels for your packages but want to stay anonymous then this is for you.  I scoured the net and found a site that you can print any and all labels for usps  fedex  and canada post.  Stop putting stamps and writing the addresses  its too obvious now and most packages with stamps get busted. You need professional printed labels for your packages.    Priority First class Overnight Express International first class/express And many many more options.,No refunds.,5.70 USD,1873 124 0,Comments (0),
onion updated deepweb links 16 000+ cream of onion,INSTANT DELIVERY TO YOUR INBOX  THESE ARE THE LATEST AND THE GREATEST OF TOR FOR 2023.  THIS IS THE MOST UP TO DATE AND LARGEST 2023 LIST OF DEEPWEB LINKS ON THE MARKETS. JUNE 1 2023 UPDATED  IF YOU CAN DREAM IT AND CANT FIND IT ON DREAM MARKET THEN YOU WILL FIND IT ON THESE LISTS.  Be careful on the darknet.,No refunds.,5.70 USD,1873 124 0,Comments (0),
latest antidetect 7.3 +4000 configs 2023,INSTANT  DELIVERY TO YOUR INBOX  ANTI DETECT BROWSER  Anti detect is perhaps considered the best and secure browser in the world because of its many features including  ?BROWSER FINGERPRINT  WHAT IS A BROWSER FINGERPRINT?   Browsing fingerprinting is a term used to describe the collection of data to give a user  or client  a unique identifier. A simple example of data used to create unique fingerprints would be a user agent string. This data is often included in fullz profiles.  However  a browser fingerprint is not at all limited to user agent str ings This is just one of many unique identifiers that can and will affect your transactions.  HOW DO WEBSITES USE FINGERPRINT  Other variables such as Flash version  keyboard layout  language settings  MIME settings  time zone  OS version  browser extensions  screen resolution  and many others are collected and organized to build profiles to verify the authenticity of returning users. Companies such as MaxMind  SAS  and ProScore se,No refunds.,5.70 USD,1873 124 0,Comments (1),n********: cant believe i paid for a Virus
ultimate launder money convert illegal money,★★★★INSTANT  DELIVERY TO YOUR INBOX★★★★  This will teach you how to transform your dirty money in a 100% legit money.  Wash out your illegal money and transform it in legal money which you can use to buy whatever you want (cars  houses  restaurants  etc) with your real name.,No refunds.,5.70 USD,1873 124 0,Comments (0),
antidetect 7.3 + fraudfox vm + ccleanerpro,INSTANT DELIVERY TO YOUR INBOX  ANTI DETECT BROWSER  Anti detect is perhaps considered the best and secure browser in the world because of its many features including  ?BROWSER FINGERPRINT  WHAT IS A BROWSER FINGERPRINT?   Browsing fingerprinting is a term used to describe the collection of data to give a user  or client  a unique identifier. A simple example of data used to create unique fingerprints would be a user agent string. This data is often included in fullz profiles.  However  a browser fingerprint is not at all limited to user agent strings This is just one of many unique identifiers that can and will affect your transactions.  HOW DO WEBSITES USE FINGERPRINT  Other variables such as Flash version  keyboard layout  language settings  MIME settings  time zone  OS version  browser extensions  screen resolution  and many others are collected and organized to build profiles to verify the authenticity  of returning users. Companies such as MaxMind.,No refunds.,5.70 USD,1873 124 0,Comments (0),
business ing bank account + kraken exchanger conne,I can provide IBAN from : - Poland -German -Netherlands  Each set include:  -Debit card -Sim card -Photo of ID Card -connected exhcnager  SEPA / SWIFT / IBAN online-banking transactions - 25k to 300k /daily ATM - 10k /daily 0 balance  Can open personal and businesses accounts also persona on specific name.  We can also work on percentage can provide cash out to BTC service.  Feel free to ask me:  ICQ - 746 089 164 micloo@xmpp.jp,,2 223.00 USD,2149 196 0,Comments (0),
android carding setup no rooting cashout hacking,★★★★INSTANT DELIVERY TO YOUR INBOX★★★★  THIS IS THE BEST AND EASIEST GUIDE TO MAKING YOUR ANDROID DEVICE A CARDING WEAPON  NO BULLSHIT.  EASY TO SETUP  NO ROOTING YOUR PHONE NEEDED  ALL YOU DO IS DOWNLOAD A FEW APPS AND YOUR ON YOUR WAY TO MAKING SOME MONEY.  ENOUGH FAILING WITH YOUR GUIDES LETS MAKE SOME REAL MONEY$$,No refunds.,5.70 USD,1873 124 0,Comments (0),
fbi hacking and forensic toolkit hack into phone,INSTANT DELIVERY TO YOUR INBOX  Welcome   This professional software worth THOUSANDS OF DOLLARS. for retrieving data  bypassing passwords  decrypting passwords for computers phones extracting data from computers and phones including passwords  deleted files  encrypted files  credit card numbers and more. ALL THIS sofware is Legitimate and worth thousands of dollars  -----  Instant Delivery for instant delivery  please dont write anything in the buyer notes.  These are some of the programs includes: Oxygen Forensics: http://www.oxygen-forensic.com/en/ Retrieve deleted texts bypass phone lock screens and more Finds passwords to encrypted backups and images Disables screen lock on popular Android OS devices Extracts data from clouds: iCloud  Google  Microsoft  etc. Offers import and analysis of call data records  Passware forensics: https://www.passware.com/kit-forensic/ Allows you to hack over 280 file types this works with elcomsoft software together. Hack all files Instant,No refunds.,5.70 USD,1873 124 0,Comments (1),g**************: So much valuable information for such a great price.  I was very please with the information given and it was able to help me solve my issue.  Thanks
20 carding videos + 55 methods cashout cc to btc,ORIGINAL 20 CARDING VIDEOS + 55 METHOS CASHOUT CC TO BTC +45 GB 6k/Day + 12.000 METHODS    FREE BONUS ITEMS FOR LEAVING POSITIVE FEEDBACK   Welcome  are you ready to make some serious cash? Enough buying this garbage  get your hands on REAL SHIT   What to expect from us? Only the BEST quality material  ready to use Our goal? YOU MAKING SERIOUS CASH NOW LETS MAKE MONEY BABY  -  PACKAGE -   VIDEO 1 - Stay Anonymous  changing socks5/location the right way My TOP 15 socks providers INCLUDED   VIDEO 2 - Connecting to RDP the right WAY   VIDEO 3 - 10 Best Places to Buy Bitcoin  VIDEO 4 -Need to Know Basics of Carding  VIDEO 5 - How to Card where to start  VIDEO 6 - Carding 101  VIDEO 7 - Cashing out CC in front of YOU  making 250 in 15 minutes  VIDEO 8 - Carding WITHOUT CC  VIDEO 9 - EASY Cell Phone Carding  VIDEO 10 - Simple VPN Carding  VIDEO 11 - Basic Amazon Checkout Method  VIDEO 12 - Stripe Cahout  VIDEO 13 - Cashing out PAYPAL accounts  200 sent in less,No refunds.,5.70 USD,1873 124 0,Comments (2),m******: GREAT Seller..would buy again thanksa********: order was delivered quickly.. now going to check on it.... but really appreciate for delivering product so quickly    
apple pay carding guide make thousands updated,★★★★INSTANT  DELIVERY TO YOUR INBOX★★★★  I would first like to introduce myself. My name is breadsdrugged I have spent more than 5 years making money online with sly methods.  I have always found the darkweb interesting and I have stepped in to sell methods.  You see many methods of $1 of which 90% is qualitatively not good. I love to deliver true quality for premium prices.,No refunds.,5.70 USD,1873 124 0,Comments (0),
cc validator ++ ipbin ++ bin checker ++bin search,INSTANT DELIVERY TO YOUR INBOX  Validate  Verify  Check Credit Card or Debit Card Number  This checker will support all major credit and debit card brands: VISA  MasterCard  American Express  Diners Club JCB  Voyager  Once you type in just the number of the card it will give you this information: BIN   Account Number   Checksum   BIN Details Details for BIN  BIN   Issuing Bank   Card Brand   Card Type   Card Level   ISO Country Name   ISO Country A2   ISO Country A3   ISO Country Number   Issuers Website   Issuers Contact    Combo IP/BIN Checker and Validator   IP/BIN Checker tool is designed to check a possibility of fraud for credit card transactions. The IP address is used to find the customers current location while the bank identification number BIN identifies the card issuing bank and its country of issuance. Both checks will allow specific combinations of two countries thus identified whether the transaction to be accepted or rejected.  Both IP address and Bank,No refunds.,5.70 USD,1873 124 0,Comments (0),
