Heading,Tab1,Tab2,Price,Stats,Comment,CommentInfo
how to safely pass counterfeit money,★★★INSTANT DELIVERY TO YOUR INBOX★★★  This will teach you how to safely pass counterfeit money.,No refunds.,5.70 USD,1873 124 0,Comments (0),
fullz cashout guide latest cc/cvv online shopping,★★★INSTANT DELIVERY TO YOUR INBOX★★★   This will teach you how to cashout CC/CVV and FULLZ online shopping.  IMPORTANT: THIS IS A GUIDE  NOT FULLZ,No refunds.,5.70 USD,1873 124 0,Comments (0),
socks5 clean proxy - socks + country + city + zip,VERY IMPORTANT! I will provide the closest socks5 based on your request.  The proxy will usually work for 12 HOURS  more if you are lucky. Plenty of time to do what you need. This is NOT a lifetime proxy! That means if your desired location has a low population with no proxies  I will provide you the closest one up to 15miles-80miles radius. So it is possible you receive proxies from other cities  instead of your chosen one. Remember that when you are chosing a low populated city. YOU HAVE BEEN WARNED!  Please provide as much information as you can. If you leave the buyer message empty  you will receive a random proxy: ========================================================= IP COUNTRY STATE CITY ZIP =========================================================  I am selling private elite SOCKS for any country/state. You will receive the best anonymity and no level of blacklist/spam.  Please make sure to include your Country+State+City of choice in the buyer notes.  If we do not have the one desired by you we will check locations within 30 miles or we will cancel your order and refund your BTC.  We provide residential  secure  clean proxies which can provide an IP address within a few miles of the cardholder.  These proxies cannot be identified as such by merchants and security companies if the fraudster uses them correctly.  Delivery time: 12 - 24 hours,No refunds.,5.70 USD,1873 124 0,Comments (0),
western union and moneygram guide cc/cvv,★★★★INSTANT  DELIVERY TO YOUR INBOX★★★★  This method is the fastest cashout method available at this tine and the easiest. If done right you can cashout multiple times in one day.   Western Union and Moneygram are unable to stop this so take advantage while you still can.,No refunds.,5.70 USD,1879 131 0,Comments (0),
eu bank drop - loaders needed,DE BANK DROP AVAILABLE FOR LOADING AND CASHOUT WE LOOKING FOR LOADERS TO WORK WITH  CONTACT ME ON WICKR: TOMMYOULS  PLEASE ONLY LEGIT LOADERS  NO TIME WASTERS,.,3.41 USD,1074 127 1,Comments (0),
pandemic unemployment insurance ( pua ) profiles!!,Here is what I do for this listing to make sure that you get fresh pua fullz that haven't been used. When order is placed  I will send you 3 sets of fullz and then you go attempt to apply on pua site and you tell me which fullz you want to use on the scans. You do not need the scans until you verify your account so you can easily apply for pua. If it goes through and ready for docs  shoot me a message and I'll get the documents done for you in under an hour. This is to make sure that the fullz have not been used already for PUA. If this isn't what you are wanting  that's fine and I want to make sure you know before you place order.       PROFILE INCLUDES:  Front and Back Drivers License Scannable SSN Card Scan Utility Bill Fullz with Correct DL # Background Check  *If there is something else you want included  message me and we can come to a deal* Price Total - $75  While I don't have unlimited access to all the fullz  you can request a certain state but let me tell you New York is the hardest to get right now. If you have any other state you want to use  I can guarantee I will find a fresh one for you.    *OVER 500 SALES OF THIS LISTING ON EMPIRE MARKET AND DARK MARKET WITH LVL 5 AND TRUST LVL 5. RATING OF 4.96   Dear Buyers    I am a normal person just like all of you and I have a day time job I work as well so I am not able to check Empire more than twice a day. I access whenever I have a convenient time  but please give me time in respond. I will send order within the time alloted  but if you have any questions for anything and need an immediate answer. You can contact me on any of the following platforms and I will answer ASAP.    All of the information on our site is strictly for educational and research purposes only. We do not encourage or condone anyone to engage in illegal activity,NO REFUND. WILL REPLACE IF MISTAKE IS ON MY END,85.50 USD,2326 197 0,Comments (0),
make $20k selling branded counterfeit watches ebay,★★★★★INSTANT DELIVERY TO YOUR INBOX★★★★★  MAKE $20k SELLING BRANDED COUNTERFEIT WATCHES ON EBAY  MAKE OVER $20 000 A WEEK SELLING BRANDED COUNTERFEIT WATCHES ON EBAY - ARMANI  MICHAEL KORS  TISSOT  DIESEL AND MORE - WATCH QUALITY 1 : 1 + BONUS VIDEO HOW TO AVOID SUSPENSION - UPDATED (SEE PICTURES).. I PROVIDE SUPPLIERS ALSO    Do you want to make $20 000-$100 000+ a month and finally have financial freedom?    We will show you how to sell BRANDED counterfeit items on EBAY and stay 100% safe ! Detailed guide step by step with PROOF of earnings OF $1K per day and pictures of items to sell with all the details where to get items!    Easy money to be made here. Once a day go to post office  send your stuff to customers and enjoy your money !    Change your life once and for all and VOUCH us later !    We are currently making $100k+ a month selling this stuff on Ebay NO BS !!! (Proof in Tutorial)   Selling Armani  Michael Kors  Diesel  etc.   If you are serious  this GUIDE will change your life forever !!!   Profit per each sold watch is around $100 - $150   We are getting them for $60 so remember you have to get 1 sale to get your investment back and TRUST me sales are coming in like CRAZY !!!    Once that information is provided you can sell like CRAZY and i mean that ! (Proof inside),No refunds.,5.70 USD,1874 124 0,Comments (0),
chase bank drop + fullz + debit card,Self-Registered Chase Bank account using USA Fullz  You will get : All Person info Credit report Background report Login details Email Access Phone number access Portable Firefox  Debit Card can be shipped for your drop mailing address.  You can use them to Cash out bank transfers   checks   Payment processor   etc..  Its like an normal bank but registered on a stolen identity  Please include your drop address if you choosed the debit card option,1- Verified accounts are checked manually before being sent - No refund 2- i will show you screenshots of verification confirmation and of the account before i send the order and i will be with you until you login successfully. 3- After you login sucessfully i delete all account info and now my work is done i only provide verified accounts. 4- i'm not responsible for Flagging the account or banning it due to your OpSec   i only sell the account and from here my work is done and the account is your responsibility 5- After you buy the account you should change email/phone to yours 6- Once we agree on Account company and bank drop you cannot change it after we arranged what i will supply. 7- ONLY replacements/refunds for NOT verified accounts or unvalid data,91.20 USD,2052 198 0,Comments (0),
chase bank drop + fullz + debit card clone,Self-Registered Chase Bank account using USA Fullz  You will get : All Person info Credit report Background report Login details Email Access Phone number access Portable Firefox  Debit Card can be shipped for your drop mailing address.  You can use them to Cash out bank transfers   checks   Payment processor   etc..  Its like an normal bank but registered on a stolen identity  Please include your drop address if you choosed the debit card option,1- Verified accounts are checked manually before being sent - No refund 2- i will show you screenshots of verification confirmation and of the account before i send the order and i will be with you until you login successfully. 3- After you login sucessfully i delete all account info and now my work is done i only provide verified accounts. 4- i'm not responsible for Flagging the account or banning it due to your OpSec   i only sell the account and from here my work is done and the account is your responsibility 5- After you buy the account you should change email/phone to yours 6- Once we agree on Account company and bank drop you cannot change it after we arranged what i will supply. 7- ONLY replacements/refunds for NOT verified accounts or unvalid data,91.20 USD,2052 198 0,Comments (0),
how to open your own bank drops,Most Carders these days have lots of trouble with finding a Bank drop.  The best thing to have is just your own bank drop where you have all control over.  Most of the time they are very hard to get because of papers and hard fraud detection plans.  Bringing an end to that!  This guide will tell you exactly how to open your OWN BANK DROP  Open YOUR OWN BANK DROP NOW   Feel free to ask any questions,Feel free to ask any questions,18.24 USD,1906 156 0,Comments (0),
chase bank drop + fullz + debit card,Self-Registered Chase Bank account using USA Fullz  You will get : All Person info Credit report Background report Login details Email Access Phone number access Portable Firefox  Debit Card can be shipped for your drop mailing address.  You can use them to Cash out bank transfers   checks   Payment processor   etc..  Its like an normal bank but registered on a stolen identity  Please include your drop address if you choosed the debit card option,1- Verified accounts are checked manually before being sent - No refund 2- i will show you screenshots of verification confirmation and of the account before i send the order and i will be with you until you login successfully. 3- After you login sucessfully i delete all account info and now my work is done i only provide verified accounts. 4- i'm not responsible for Flagging the account or banning it due to your OpSec   i only sell the account and from here my work is done and the account is your responsibility 5- After you buy the account you should change email/phone to yours 6- Once we agree on Account company and bank drop you cannot change it after we arranged what i will supply. 7- ONLY replacements/refunds for NOT verified accounts or unvalid data,91.20 USD,1656 198 0,Comments (0),
ing bank account + kraken open beneficiary accoun,Each set include:  -Debit card  -Sim card  -Photo of ID Card  -exchanger  Account on verified bity.com or polish 4coins.pl or Kraken  bity.com - 25k daily limit buy BTC with SEPA transfer  4coins.pl - 25k euro daily limit by instant transfer  Kraken - 35k euro daily SEPA transfer  SEPA / SWIFT / IBAN  online-banking transactions - 25k to 100k  daily ATM - 10k /daily  0 balance   Can open personal and businesses accounts also persona on specific name.   We can also work on percentage can provide cash out to BTC service.   Feel free to ask me:  ICQ - 746 089 164  Jabber - micloo@xmpp.jp,,4 674.00 USD,4784 199 0,Comments (0),
italian bank account with verified exchanger,Hello Darkoders  What are you buying here ?  Included: Italian Bank account  Complete ID: ID card Proof of address Tax Code Picture Selfie with ID Selfie with ID + Paper Sim Card Phone Connected to the account,Refund in case of account blocked  but everything get checked before delivery.,6 626.67 USD,2037 191 0,Comments (0),
buy 2 get 1 free bybit account with $4000 balance,BUY 2 GET 1 FREE bybit account with 4000 balance+ email access  Bybit is a crypto exchange located in the British Virgin Islands. It is a cryptocurrency derivatives platform with only two trading pairs BTCUSD  XRPUSD  EOSUSD and ETHUSD.   What you get upon purchase   Login Password Email address and password IP Name Address pin Phone number Useragent Cash out guide Ask me questions and make enquiry before you buy   Our accounts are verified with ID  SSN  Phone Number and Email. All balances have 4000 dollars or more in them guaranteed. Bitcoin purchased enabled. Debit card attached.  Due to recent influx in the amount of noob customers purchasing my listings without sufficient knowledge on how to use i strongly suggest you purchase my 2 days or 7 days tutorial for you to learn and stand confident when trying to access these accounts  there is a possibility that you might encounter 2fa but do not worry there is a way to bypass this easily which i will send to you for free after purchase.    So how many of you are tired of being noobs  or are still looking for the right high paying niche in the fraud world  or want to have a steady monthly or weekly income through the dark means this is for you.  To get the chance to discuss anything fraud with me  discover new methods and guides or if you need my professional advice on fraud then I suggest you buy my 7days tutorial listing below.   BE SURE TO CHECK MY SHOP FOR accounts  FRAUD GUIDES  HACKING FRAUD SOFTWARE AND OTHER ITEMS - THE VERY BEST YOU CAN FIND ON THE MARKET.   IN ADDITION  LOYAL CUSTOMERS WILL PERIODICALLY RECEIVE GIFT VISA/MASTERCARD CC - SO DO NOT MISS OUT      keyword:   cashapp paypal account fraud dark market cc apple guides tutorial money mentor credit card fraud debit card fast paypal carded items software malware counterfeit fraud guides tutorials identification jewellry miscellaneous security hosting services drugs digital goods fast money bitcoin method cc high balance crack heroin cocaine weed meth skrill coinbase monero transfer money instagram western union cashapp bitstamp cashout bank login hq paypal balance cookies credit accounts account proxy cheap paypal balance paypal credit cc fullz onlyfans cc attached 2FA paypal.com carding proof ccv details cashout working 2023 2023 method ultimate guide paypal fraud paypal carding paypal to btc paypal balance pp ssn credit card bank account paypal paypal balance paypal credit paypal money paypal credit card paypal cc carding money cvv paypal account venmo rdp vps virtual private server remote desktop vnc hacked cracked cvv known real balances credit card fraud Fresh Sniffin best Quality US FULLZ CC CVV (ssn & dob) US cc carding cookies credit accounts account proxy cheap cc fullz onlyfans cc attached 2FA carding proof ccv details cashout working 2023 working fresh sniffed method ultimate guide ssn credit card bank account cc carding money account USA CC HQ LIVE high balance classic standard platinum signature discover world Level Classic Platinum Signature buisiness premier gold world card prepaid electron green infinite gold premium purchasing new world centurion black consumer card corporate world elite small fleet purchasing coporate card optima blue atm gsa pin ebt global payment world debit premium plus sbs gold green plus business elite charge travel money v pay gift lowes card Visa Mastercard American Express Disc-diners Discover Maestro JCB; China Union Pay Laser creditcard cc cvv credit debit charge card wells frago hansa chase bank of america boa capital neteller paypal Monese accounts  Paysera account shopify N26 accouunts  paysend account  earnin account  betway account   Revolut account  bet365 accounts  bovada and mybookie account How make money online transfer Google Amazon Spotify AppleStore Zoom Venmo either.io archive.org discord.com genshin.mihoyo.com PayPal Google Sony Twitter TikTok MEGAnz NvidiaStore Live Amazon GitHub Venmo Spotify AppleStore SteamGoogle  Facebook  AppleStore  Pof  Google  Amazon  AppleStore  Yahoo  PayPal  Webmail  Slack  LinkedIn  Google  Bwin  Facebook  Bet365  Ebay  Unibet  Betfair  AppleStore  Live  Zoom  LinkedIn  Booking Amazon  Office365  888sport  Binance  Skrill  PayPal  Pinterest  Instagram  LenovoStore  Bitstamp  WIX  Betway  Uber  Aliexpress  Bitfinex  EToro  Emirates  Stripe  QatarAirways  Facebook  O2online  T-mobile  GoDaddy  Binance  1and1Panel  2Checkout  Steam  Kraken  Coinmama  Bittrex  Netflix  TurkishAirway  Shopify Skype  Ebay  Fiverr  Gemini  LocalBitcoin  Bitstamp  Skrill  Coinbase  Bitfinex  Upwork  Immobilie  Xoom  Dropbox  Uber  GitHub  Yahoo  Live  Messenger  ADP  Netflix  Ebay  Xfinity  PayPal  Twitter  FedEx  Instagram  FirefoxAccount  Uber  PaycorPay  ATT  LinkedIn  Tumblr  Amazon  Greendot  Capitalone  HRBlock  SonyEnter  Indeed  Monster  Craigslist  Ancestry  Walmart  TaxAct  Coinbase Google  Office365  Facebook  Amazon  Groupon  Wordpress  Sprint  Intuit  Uber  ADP  LowesStore,TERMS AND CONDITION If you have issues with your product please let me know  REFUND or replacement IS PROVIDED only if you upload a video on anonfiles.com or google drive of where you logged in and  please record it in a detailed mannerism i need to see your hands typing from where you set your socks5  vpn and Vm etc to confirm that you know what your doing and if everything checks out ok i will replace or refund. ONLY 24 HOURS AFTER PURCHASE more time for bulk purchases if 24 hours elapses your query will be discarded.this is to phish out scam buyers  Upon purchase of an order it is assumed you know how to use so I will not be held liable if you get 2fa and I will not replace or refund but instead help you to bypass any blockage you might have if you exercise patience and have an open mind.,178.34 USD,1977 197 0,Comments (0),
fully verified cashapp btc enabled + bank drop,Self-Registered Fully Verified USA CashApp BTC  Instant Bitcoin Purchase!  NO AN/RNs you need to change address and order Cash Card to activate them  Limits are ADD 2500 per week Receive unlimited Cashout 25000 per week  BITCOIN IN APP Purchase 100k per week Withdraw 2000 per day Deposit 10000 per week  You need to change the mailing address after you buy then request your Cash Card to your drop address.  The account is created with an stolen identity and fully verified by me.  You will get : Full Person info CashApp Login details Email Access Google Voice account  You can add Bank Drop created with the same info,Accounts are manually checked before being sent.,91.20 USD,2052 198 0,Comments (0),
