Heading,Tab1,Tab2,Comment,CommentInfo
100% save and anonymous pc setup (download guide),This is a PDF which explains you  a Beginner  what exactly you need for whatever illegal activitys you want to do. With this setup you are 100% save and anonymous. I included a list with all the free Programs you need to be sucessful. I also include a detailed Guide how to setup Firefox to not get busted.  Only thing you need to buy? Nord VPN. But you will find accounts starting at 0.90€ on DARKODE. Or you buy it Official.,IN CASE YOU ARE NOT SATISFIED WITH OUR PRODUCT CONTACT US AND WE FIND A SOLUTION. CUSTOMERS WHO ORDER THE FIRST TIME AND ARE NOT LVL 2 AND/OR HAVE ALREADY A OPEN DISPUTE WILL NOT BE REFUNDED  OR GET RESHIPMENT.,Comments (0),
how to safely pass counterfeit money,★★★INSTANT DELIVERY TO YOUR INBOX★★★  This will teach you how to safely pass counterfeit money.,No refunds.,Comments (0),
2023 antidetect 7.3 + fraudfox vm + 4000configs,★★★★★INSTANT DELIVERY TO YOUR INBOX★★★★★  For receiving instantly : Please leave buyer note empty  ANTI DETECT BROWSER  Anti detect is perhaps considered the best and secure browser in the world because of its many features including;  🔥BROWSER FINGERPRINT  WHAT IS A BROWSER FINGERPRINT?   Browsing fingerprinting is a term used to describe the collection of data to give a user  or client  a unique identifier. A simple example of data used to create unique fingerprints would be a user agent string. This data is often included in fullz profiles.  However  a browser fingerprint is not at all limited to user agent strings! This is just one of many unique identifiers that can and will affect your transactions.  HOW DO WEBSITES USE FINGERPRINT  Other variables such as Flash version  keyboard layout  language settings  MIME settings  time zone  OS version  browser extensions  screen resolution  and many others are collected and organized to build profiles to verify the authenticity  of returning users. Companies such as MaxMind  SAS  and ProScore sell these as Predictive Analysis Decision models.  it takes all of this into account and helps you quickly modify  customize  import and export your settings to better match your card holder profiles.  WHAT DOES ANTI-DETECT DO?  simple : antidetect browser is able to clone /copy any browser details such flash   browser version   name   ip address   mac address   installed add-ons and many other parameters that means you will be able to clone any details of the browser used by the user you want to card and the target ted sites will think this is the legit user and will not block your carding attempt  Anti detect browser cost more than 300$ when you purchase it.  FRAUD FOX  Fraudfox is a Virtual Machine based on VMWare.  VMWare is software that mimics another computer’s setup  the VM stands for Virtual Machine.  For instance you can use VMWare on a Mac laptop and run it up so that you have a Windows desktop running inside of your Mac environment  giving you access to use programs and features that only Windows employs.  FraudFox has the ability to spoof not only the operating system requirements of a machine but also the browser fingerprint that you are using also...,No Refund,Comments (0),
critical security flaws in android devices,Critical Security Flaws in Android Devices Affecting Millions of Users  AN IT SECURITY FIRM CHECKPOINT HAS DISCOVERED A SET OF CRITICAL SECURITY FLAWS IN SEVERAL ANDROID DEVICES AFFECTING 900 MILLION USERS WORLDWIDE.  Why Buy from us: - We deliver full support on all of our products  So if you have any questions please let us know. - All our guides work world wide - You will get a 100% satisfaction guarantee  so if you are not 100% satisfied with your purchase we will refund your order. - If you leave positive feedback you will get a product of your choosing for free. - Instant delivery.  If you have any questions please let us know.  NOTE:  ALL MATERIAL  SOFTWARE  TUTORIALS ARE STRICTLY FOR: ACADEMIC  RESEARCH  EDUCATIONAL and TRAINING ONLY  WE DO NOT CONDONE ILLEGAL ACTIVITIES,Please dont forget to release the order and feel free to leave feedback. if you have any issue please contact me first   Have a nice day,Comments (0),
complete opsec tutorial,Complete OPSEC tutorial  basic to advanced. Let me know your requirements and setup and I can give guidance on OPSEC,No refund,Comments (1),m********: Excellent service. A real pro.
20 carding videos + 55 methods cashout cc to btc,ORIGINAL 20 CARDING VIDEOS + 55 METHOS CASHOUT CC TO BTC +45 GB 6k/Day + 12.000 METHODS    FREE BONUS ITEMS FOR LEAVING POSITIVE FEEDBACK   Welcome  are you ready to make some serious cash? Enough buying this garbage  get your hands on REAL SHIT   What to expect from us? Only the BEST quality material  ready to use Our goal? YOU MAKING SERIOUS CASH NOW LETS MAKE MONEY BABY  -  PACKAGE -   VIDEO 1 - Stay Anonymous  changing socks5/location the right way My TOP 15 socks providers INCLUDED   VIDEO 2 - Connecting to RDP the right WAY   VIDEO 3 - 10 Best Places to Buy Bitcoin  VIDEO 4 -Need to Know Basics of Carding  VIDEO 5 - How to Card where to start  VIDEO 6 - Carding 101  VIDEO 7 - Cashing out CC in front of YOU  making 250 in 15 minutes  VIDEO 8 - Carding WITHOUT CC  VIDEO 9 - EASY Cell Phone Carding  VIDEO 10 - Simple VPN Carding  VIDEO 11 - Basic Amazon Checkout Method  VIDEO 12 - Stripe Cahout  VIDEO 13 - Cashing out PAYPAL accounts  200 sent in less,No refunds.,Comments (0),
privazer 4.03 donors edition + serials- better tha,Privazer PC cleaner  look at youtube comparison between Ccleaner and Privazer. Some say this is much more effective than CCLeaner. update: Feedback from the first 2 buyers seems like it is much better than Ccleaner  Well testing it wont hurt you for 99 cents?  version 4.03 including 3 activation keys,Non refundable  this just works if not  contact me,Comments (0),
guide to anonymity on the darkweb and tor,This is a detailed guide on the use of the dark web it also offers insight into a lot of privacy tips and how to stay safe on the internet and even in real life it has very detailed information on the use of tor  the dark art of anonymity  the use of burners and the black markets  the invisibility toolkit  Usenet and the dark net this guide contains beneficial information to anyone who is looking to be anonymous on the internet and maintain a good op-sec,No Refunds,Comments (0),
uber fraud pack make $2500 monthly,INSTANT DELIVERY TO YOUR INBOX   This is VERY EASY to do and use and Replicate so you can literally retire if you have enough accounts getting paid.  This quick and complete guide explains you how to cashout credit cards trough an easy processor.  What is needed to use the method? A solid Bank Drop Rooted Phone Or Android Emulators Created or Hacked Uber accounts   What we will be doing?  We will be using social engineering to get an approved google driver account  then fake rides and get payments into our bank account.  Works in all countries where Uber is.  WORLDWIDE WORKING  You will get these Guides:  Free Rides System  Get Free Rides FOREVER. Hack Ubers Driver System Make thousands Being a Fake UBER DRIVER Use this guide to easily trick Uber into paying you to be a driver while actually not leaving our home Unlimited Uber rides  you will learn how to get free unlimited UBER rides as well.,No refunds.,Comments (0),
ultimate fraud expert opsec setup,HELLO VIEWERS... TODAY YOU ARE GONNA HAVE MOST COMPLETE  POPULAR & EASY TO FOLLOW FRAUD EXPERT OPSEC SETUP GUIDE. IF YOU HAVE THIS ONE  YOU DONT  NEED ANY OPSEC GUIDE IN MANY YEARS TO COME. ITS A 221 PAGES OPSEC GUIDE'S MAIN PURPOSE IS TO KEEP YOU SAFE AND SUCCESSFUL FRAUDSTER TILL THE END. RAUD EXPERT OWhat if one day your computer was ever stolen from your home  hotel room or rental car? What if it was borrowed by a friend of yours/family relative and lost or forgotten at school or on the bus? What if you were robbed and your backpack stolen? What if the police ever raided your home and took control of your digital devices to conduct a thorough investigation  that could potentially leave you in a dire situation  where you could face years in prison? What if any of a thousand scenarios occurred that resulted in you losing physical control  whether permanently or temporarily  of your computer? In any of these instances the new owner of the computer may try to take a look at your data. What will they find there?   PSEC SETUP  BY HELTER SQUAD  BASIC COMPUTER SECURITY WEB BROWSER SECURITY FIREFOX ABOUT:CONFIG  FIREFOX ADD-ONS    ONLINE ACCOUNT SECURITY SOCIAL NETWORKS ANONYMOUS PURCHASES ANONYMOUS TELEPHONES SMARTPHONE SECURITY COMPUTER SECURITY: DATA-AT-REST COMPUTER SECURITY: DATA-IN-MOTION COMMUNICATION SECURITY: EMAIL COMMUNICATION SECURITY: VOICE AND TEXT SECURE FILE DELETION STATELESS OPERATING SYSTEMS LAUNDERING YOUR BITCOINS ALIASES MAKING YOUR HOME INVISIBLE CONCLUSION,No Refund!,Comments (0),
android carding setup no rooting cashout hacking,★★★★INSTANT DELIVERY TO YOUR INBOX★★★★  THIS IS THE BEST AND EASIEST GUIDE TO MAKING YOUR ANDROID DEVICE A CARDING WEAPON  NO BULLSHIT.  EASY TO SETUP  NO ROOTING YOUR PHONE NEEDED  ALL YOU DO IS DOWNLOAD A FEW APPS AND YOUR ON YOUR WAY TO MAKING SOME MONEY.  ENOUGH FAILING WITH YOUR GUIDES LETS MAKE SOME REAL MONEY$$,No refunds.,Comments (0),
xss security days,XSS Security Days  Why Buy from us: - We deliver full support on all of our products  So if you have any questions please let us know. - All our guides work world wide - You will get a 100% satisfaction guarantee  so if you are not 100% satisfied with your purchase we will refund your order. - If you leave positive feedback you will get a product of your choosing for free. - Instant delivery.  If you have any questions please let us know.,Please don't forget to release the order and feel free to leave feedback. if you have any issue please contact me first   Have a nice day,Comments (0),
new lockscreen ransomware targeting android device,New Lockscreen Ransomware Targeting Android Devices  SYMANTEC SECURITY CLAIMS ANDROID LOCKSCREEN RANSOMWARE USING PSEUDORANDOM PASSCODE TO ENSURE VICTIM PAYS THE RANSOM.  Why Buy from us: - We deliver full support on all of our products  So if you have any questions please let us know. - All our guides work world wide - You will get a 100% satisfaction guarantee  so if you are not 100% satisfied with your purchase we will refund your order. - If you leave positive feedback you will get a product of your choosing for free. - Instant delivery.  If you have any questions please let us know.  NOTE:  ALL MATERIAL  SOFTWARE  TUTORIALS ARE STRICTLY FOR: ACADEMIC  RESEARCH  EDUCATIONAL and TRAINING ONLY  WE DO NOT CONDONE ILLEGAL ACTIVITIES,Please dont forget to release the order and feel free to leave feedback. if you have any issue please contact me first   Have a nice day,Comments (0),
ccleaner professional - newest version,Must have utility for every Darknet user ! This is Pro version   not freeware !  If your PC is slow  crashing or running out of hard drive space  CCleaner Professional is  the solution. Its patented cleaner clears the clutter from your hard drive  removes junk  from the Windows registry  and protects your privacy by removing tracking cookies and  browser history. All without touching your documents  music  videos and other files. If you have more than one person using your PC  CCleaner Professional can clean multiple  user profiles. With system monitoring it keeps an eye on your system in the background  and cleans when needed.   Make your PC last longer CCleaner Professional speeds up your PC and  recovers hard drive space. It’s like getting a  brand-new PC for a fraction of the cost.  Be safer online Advertisers and websites track your behavior  online with ‘cookies’ that stay on your computer.  CCleaner Professional erases these cookies  so any browsing you do stays confidential.  Reduce crashes The registry stores Windows settings. Over  time  it can become cluttered and filled with  errors  and can lead to crashes. CCleaner  Professional’s patented registry cleaner clears  out the clutter so your PC is more stable.  Speed up your startup Many programs run silently in the background  when you start your PC. CCleaner Professional  helps you get to work – or play – faster by  letting you disable unneeded programs.  Easy to use If you can use email  you can use CCleaner  Professional. It’s point-and-click  and you  decide what to clean and what to keep.  Software + serial  We decline any responsibility on the use you will have with our products. Product sold for informational purposes only.  Everyone is free to choose their use...,Non functional items will be refunded.,Comments (0),
make big money on darkmarkets become vendor guide,INSTANT  DELIVERY TO YOUR INBOX  How to make BIG MONEY on DARKMARKETS 100% WORKING  NO BULLSHIT  step by step guide.  You will learn to sell guides and tutorials in the dark market. I have more than $ 500 a day and sometimes much more using this method. It is easy ... Stop working and get a better life. Easy money for all. Noob friendly.  No long boring lectures here. All I will tell you is this  if you’re the type who feels taking from others is immoral  wrong  harsh  etc  then this isn’t for you. Your best bet is to look for a 9 to 5 or offer your services to a church and don’t bother to reading on.,No refunds.,Comments (0),
amazon refund guide - extremely detailed,INSTANT DELIVERY TO YOUR INBOX  This guide contains all the knowledge you need to successfully rape amazon and never be caught  and what you do with this knowledge  is entirely up to you. This guide was written on years of experience and some of the information you will read was provided by an ex amazon employee and his name will be provided next to it.,No refunds.,Comments (1),l******: Some interesting knowledge  thank you.
-== malwarebytes lifetime premium key ==-,Malwarebytes protects you against malware  ransomware  malicious websites  and other advanced online threats that have made traditional antivirus obsolete.  Valid Malware Bytes Lifetime Premium Keys. Keys are not stolen or bruteforced! All Keys will last forever  with lifetime support guarantee.  Format is: License ID : License Key,No refund,Comments (0),
make $20k selling branded counterfeit watches ebay,★★★★★INSTANT DELIVERY TO YOUR INBOX★★★★★  MAKE $20k SELLING BRANDED COUNTERFEIT WATCHES ON EBAY  MAKE OVER $20 000 A WEEK SELLING BRANDED COUNTERFEIT WATCHES ON EBAY - ARMANI  MICHAEL KORS  TISSOT  DIESEL AND MORE - WATCH QUALITY 1 : 1 + BONUS VIDEO HOW TO AVOID SUSPENSION - UPDATED (SEE PICTURES).. I PROVIDE SUPPLIERS ALSO    Do you want to make $20 000-$100 000+ a month and finally have financial freedom?    We will show you how to sell BRANDED counterfeit items on EBAY and stay 100% safe ! Detailed guide step by step with PROOF of earnings OF $1K per day and pictures of items to sell with all the details where to get items!    Easy money to be made here. Once a day go to post office  send your stuff to customers and enjoy your money !    Change your life once and for all and VOUCH us later !    We are currently making $100k+ a month selling this stuff on Ebay NO BS !!! (Proof in Tutorial)   Selling Armani  Michael Kors  Diesel  etc.   If you are serious  this GUIDE will change your life forever !!!   Profit per each sold watch is around $100 - $150   We are getting them for $60 so remember you have to get 1 sale to get your investment back and TRUST me sales are coming in like CRAZY !!!    Once that information is provided you can sell like CRAZY and i mean that ! (Proof inside),No refunds.,Comments (2),s**********: A+++r*****************: A+
exclu messenger,ExcluMessenger Is a chat  pgp  and calling in 1. Keep your communications confidential. Account costs 800 euro / 6 months / license  install and account info is provided after payment.  Most secure Chat  PGP  Call  System for all your communication needs all in 1. Multiple encryption layers  easy to install and use. Each License is valid 6 months  the software can be installed on Androids and Iphone.  1 License per account  it can PGP communicate with all the well known brands like chatmail  securegroup  ciphr  ghost etc..  You get excellent fast support.  Regular software and security updates and new futures added on regular bases.  The app runs in its own encrypted container  including separate build in encrypted storage for notes  send and received files  and anti trojan keyboard.  It can be installed on your current phone  without drawing attention  even its icon can be changed from any of the most popular apps making it invisible at glance  custom duress wipe can be set  and many other options.   You can be sure your safe. Any questions drop me a message.,No refund  digital delivery  any questions  please ask us before placing the order.,Comments (0),
ashampoo anti-virus 2016 - darknet security,Advanced malware protection that works  Be secure on Darknet   Real-time protection: Neutralises attacks as they happen 	  Behaviour Blocker: Monitors application behavior and prevents even not yet classified threats such as zero-day exploits 	  On-Access Guard: Neutralises infection attempts during file operations. 	  Multi-Engine Scanner: Combines two scan engines for maximum accuracy 	  Customisable whitelist to exclude files from scan 	  Web protection: Prevents access to malicious websites 	  Game mode: Handles all security issues automatically to ensure uninterrupted gameplay 	  Self-protection: Vital program parts are encrypted to prevent the circumvention of security measures  File Wiper: Protect your privacy and permanently erase files and folders to render them unrecoverable for file restoration tools. It is also possible  to overwrite empty hard disk space to prevent restoration of already deleted files. 	  Internet Cleaner: Remove your Internet traces and delete temporary Internet files  clear your browser cache and erase your browsing history. 	  Hostfile Checker: Scans your Windows hostfile for unwanted DNS redirects 	  ADS Scanner: Scan NTFS drives for invisible data streams and remove them 	  StartUp Tuner: Improve the startup time of your PC and disable unnecessary Autostart entries. 	  LSP Viewer: Manage Winsock-Layers and network activity,Non functional items will be refunded.,Comments (0),
recuva professional - technician cracked,Best solution to rescue your lost data from USB   SD card or HDD.  Recover your deleted files quickly and easily.  Accidentally deleted an important file? Lost files after a computer crash? No problem - Recuva recovers files from your Windows computer  recycle bin  digital camera card  or MP3 player!  Recuva 1.52.1086 Professional - Technician   We decline any responsibility on the use you will have with our products. Product sold for informational purposes only.  Everyone is free to choose their use...,Non functional items will be refunded.,Comments (0),
linkensphere 6.7 mod - best browser for card,Better than Antidetect 7 browser  move your carding experience to the next level    Product Presentation: www.youtube.com/watch?v=moVoW1eN52c     A boxed solution that is configured in minutes. Suitable for both beginner and prof.  Does not leave traces on the machine  does not transfer your IP and does not send hidden requests - connection to the browser via Tor  work in the OTR protocol with AES 256 encryption  Additional programs (Proxifier  Bitviser  Tor Browser) are not needed   Replaces or hides all necessary prints (GPU  Audio  Canvas  Plugins  Fonts  ClientRects  Ubercookies)   Over 60 000 built-in configurations  taken from real machines  as well as your own configuration with private configurations. Simulate any browser  operating system and type of device  Flexible configuration of any parameters up to the touchscreen and GPS   Dragging data from Maxmind   Save  load and unload cookies and session settings   Simultaneous work with various configurations and connection types (http  SSH  socks  Tor  SSH + Tor)  team work (multitier) can withstand 100+ open tabs    Now  without special knowledge  you can turn your computer in the eyes of any system into a machine with the necessary unique characteristics in a matter of minutes. If you have an advanced level  you can always customize the settings manually.  CHeck all our listings   2023 DroidJack 4.4 - Android RAT  2023 ANTIDETECT 7.3 + FRAUDFOX VM +4000Configs  2x VERIFIED Paypal Account + cookie + user agent + CC or BA  CREDIT CARDS DATA - US EU LATINO ASIA  USA HIGH QUALITY CVV DETAILS,No REFUND    Report any dead links to me,Comments (0),
malwarebytes anti-malware - protect your pc,Protect you from dangerous threats that antivirus doesn't.  Computer showing telltale signs of infection? Download our industry-leading scanner and protect against unknown and known malware.  Detects and removes malware on an infected computer with industry-leading anti-malware  anti-spyware  and anti-rootkit tech. Scans for the newest and most dangerous threats. Safely removes malware.  Runs continuously in the background  stopping infections before they happen. Scans automatically and halts attempted attacks.  Stops sites that deliver malware or sites that are compromised by malware.  Targets only active threats in Hyper Scan mode for faster analysis.  Uses proprietary Chameleon technology to prevent malware from terminating Malwarebytes or modifying its processes.,Non functional items will be refunded.,Comments (0),
ultimate antivirus collection 2023 - all is here,Best updated security collection what you can get on darkmarkets. - Fully activated antivirus software. - 23 products on one place. - All best software in one collection. - You can choose which software from collection to download. - Be safe on Darknet use best antiviruses and antimalware.  This Ultimate Collection contains:  Avast! Internet Security Premier Antivirus 2023 v19.1.2360.Build.19.1.4142  Avira Antivirus Pro 2023 v15.0.44.143  ESET Internet Security 2023 v.12.1.31.0  ESET-NOD32 Antivirus Smart Security 2023 v8.0.319.1.Multi  Kaspersky Anti-Virus 2023 v19.0.0.1088  Kaspersky Internet Security 2023 v19.0.0.1088  McAfee Endpoint Security 10.6.1.190212  Auslogics Anti-Malware 1.12 Full Crack  Ashampoo Anti-Virus 2016 - Darknet security  Avast Anti Virus 2017  AVG Internet Security v17.7.3032 + License Keys (x86/x64)  Avira Antivirus Pro 15.0.32.6 + Lifetime License Key !  ESET Internet Security 2017 v 10.0.386.0  ESET NOD32 Antivirus 2017 v10.0.386.0  ESET NOD32 Antivirus  Smart Security  Internet Security 2017 v 10.0.386.0 + License Keys  Kaspersky Anti-Virus 2017 17  Malwarebytes Anti Exploit Premium 1.12.1.42 Final Full Keygen  Malwarebytes Anti-Malware - protect your PC  McAfee VirusScan Enterprise 8.8 Patch 10 With Crack  Smadav Pro 2017  Smadav Pro 2023 Versi Terbaru Rev 11.8 Full Keygen  Trojan Remover 6.9.4.2943 Final + Cracked-SND  UnHackMe 9.70 Build 670 Full Crack,Non functional items will be refunded.,Comments (0),
print usps/fedex/canada post labels anonymous,★★★INSTANT DELIVERY TO YOUR INBOX★★★  -Dhl is also sometimes available  If you are looking for printed labels for your packages but want to stay anonymous then this is for you.  I scoured the net and found a site that you can print any and all labels for usps  fedex  and canada post.  Stop putting stamps and writing the addresses  its too obvious now and most packages with stamps get busted. You need professional printed labels for your packages.    Priority First class Overnight Express International first class/express And many many more options.,No refunds.,Comments (0),
mobiledit forensic - work like cia,Investigate Mobile Phones Using the Most Comprehensive Tool Available  Retrieve all data from a phone with one click Generate forensic reports ready for the courtroom Relied upon by the US Military  FBI  and CIA!   Analyze phones via USB cable  Wi-Fi  Bluetooth or IrDA   	  Analyze phonebook  last dialed numbers  missed calls  recei-           ved calls  SMS messages  multimedia messages  photos  files             phone details  calendar  notes  tasks  SIM cards  applicati-           ons  application data including those deleted (coming soon)            and more  	  Support for Android  iOS  Symbian  Blackberry  Windows Phone            Windows Mobile  MediaTek  Bada  MeeGo and other feature            phones covering more than 3000 fully tested devices   	  Complete driver pack with device drivers for all major phone            manufacturers included   Complete Data Extraction from Phones and SIM Cards  With MOBILedit Forensic you can view  search or retrieve all data from a phone with only a few clicks. This data includes call history  phonebook  text messages  multimedia messages  files  calendars  notes  reminders and raw application data. It will also retrieve all phone information such as IMEI  operating systems  firmware including SIM details (IMSI)  ICCID and location area information. Where possible MOBILedit Forensic is also able to retrieve deleted data from phones and bypass the passcode  PIN and phone backup encryption.  We decline any responsibility on the use you will have with our products. Product sold for informational purposes only.  Everyone is free to choose their use...,Non functional items will be refunded.,Comments (2),p**********: Good seller and Quality is TOP!!!p********: Awesome!
