Heading,Tab1,Tab2,Comment,CommentInfo
protect your pc - zemana antilogger,Zemana AntiLogger aggressively combats keyloggers of all types. Using this anti-keylogger software  you can secure your financial information and keep your personal life private. TopTenREVIEWS - Silver Award - Awarded for excellence in design  usability and feature set TopTenREVIEWS - Excellence Award - Awarded for excellence in design  usability and feature set  Zemana AntiLogger excels at fighting the most malicious type of keyloggers – financial malware. Financial malware's sole purpose is to obtain your logins  passwords  credit card numbers and banking information  as well as valuable accounts such as stock trading accounts. Once that information is obtained  it is often sold to the highest bidder. Using our Top Ten Reviews Silver Award winning anti-keylogger software  you can thwart malicious keyloggers and maintain your privacy.  This anti-keylogger also includes a unique technology called IntelliGuard. While most anti-keyloggers rely on known malware definitions and behavioral analysis of suspicious-acting elements  Zemana includes IntelliGuard  which is a cloud-based  always-up-to-date technology that stays abreast of the newest keylogging malware. It scans for threats using 40 malware databases to keep your computer and privacy secure. The software also includes tools to secure the hardware elements of your PC or laptop  such as the webcam and microphone.  This keylogger protection software battles all types of keyloggers  including those that obtain your personal information from the clipboard. It also blocks the technologies people use to turn on your webcam to spy on you and the applications that record from your microphone to gather private VoIP conversations. Many anti-keyloggers use virtual keyboards in an attempt to circumvent keyloggers; however  screen-capturing malware can obtain passwords using this method. Zemana can identify and block screen-capturing malware.  Zemana also has the ability to combat stealth malware that attempts to alter your system. This anti-keylogger actively monitors things such as rootkit installations  thread context  physical memory access  hooks  remote threads  DLL injections  kernel driver loading and system registry modifications. If the software notices anything suspicious  it will ask you if the process is something you purposely want to allow access. It can also identify purposely installed spyware or keylogger software. Keylogging or spyware software is often intentionally installed by suspicious loved ones or curious associates. Sometimes it is used to steal passwords  and other times to verify doubts. Zemana can discover and block this type of software to keep your private life private.  While turning on your webcam may not be able to steal your passwords  it is a critical threat to block. Zemana is one of the first anti-keylogging software to provide protection against this type of malware. Sadly  this type of threat does exist  and unsuspecting PC users – and even children – have been monitored and spied on. We recommend that you cover the camera when it's not in use and that you use a product such as Zemana to block access. Zemana can keep your private video conversations truly private.  Since Zemana is intended to add an additional layer of protection rather than replace antivirus software  it has been extensively tested for compatibility with popular security software. Unlike most software vendors that claim their software is compatible with most security software  Zemana actually publishes a list of the software it has tested AntiLogger with. Zemana has been tested while running with nearly 50 security products and has been proven to successfully work with Trend Micro  Webroot  Kaspersky  ESET  AVG  Bitdefender  F-Secure and Avast. Compatibility tests were run using Windows XP  Vista  7 and 8  both the 32- and 64-bit versions. AntiLogger is even compatible with the keystroke encryption software KeyScrambler. AntiLogger only requires 50MB of disk space and 256MB of memory to run.  Zemana can successfully block financial malware  in-the-wild keyloggers  installed keylogger software and hardware access. It works with most major security products and runs on all Windows-based operating systems  including 64-bit versions of Windows 7 and 8. This anti-keylogger software is at the top of its game and is one of the best keylogger protection applications on the market.   We decline any responsibility on the use you will have with our products. Product sold for informational purposes only.  Everyone is free to choose their use...,Non functional items will be refunded.,Comments (0),
20 carding videos + 55 methods cashout cc to btc,ORIGINAL 20 CARDING VIDEOS + 55 METHOS CASHOUT CC TO BTC +45 GB 6k/Day + 12.000 METHODS    FREE BONUS ITEMS FOR LEAVING POSITIVE FEEDBACK   Welcome  are you ready to make some serious cash? Enough buying this garbage  get your hands on REAL SHIT   What to expect from us? Only the BEST quality material  ready to use Our goal? YOU MAKING SERIOUS CASH NOW LETS MAKE MONEY BABY  -  PACKAGE -   VIDEO 1 - Stay Anonymous  changing socks5/location the right way My TOP 15 socks providers INCLUDED   VIDEO 2 - Connecting to RDP the right WAY   VIDEO 3 - 10 Best Places to Buy Bitcoin  VIDEO 4 -Need to Know Basics of Carding  VIDEO 5 - How to Card where to start  VIDEO 6 - Carding 101  VIDEO 7 - Cashing out CC in front of YOU  making 250 in 15 minutes  VIDEO 8 - Carding WITHOUT CC  VIDEO 9 - EASY Cell Phone Carding  VIDEO 10 - Simple VPN Carding  VIDEO 11 - Basic Amazon Checkout Method  VIDEO 12 - Stripe Cahout  VIDEO 13 - Cashing out PAYPAL accounts  200 sent in less,No refunds.,Comments (0),
anonymous parcel locker 🇦🇺 australia 🇦🇺,Fear of doxxing? Worried about sloppy vendors having your name or address (even 10 years from now)? Worried about the cops knocking on your door? Looking for a fool proof way of shielding your identity? Congrats! You found it!  Parcel lockers are still one of the best way to take delivery anonymously. We've been using them for years and swear by them.  So what you get:  One login account to Auspost (i.e. email  password).  One email account so you can check if you've received a parcel without having to log into Auspost.  One ready-made parcel locker just for you - (Optional. If you do not specify a location for the locker  we will set up a random one that you can delete if you like)  The ability to create many more parcel lockers from the same auspost account.  The mobile number we used to set up the alias account. (Optional at extra cost). A SIM card with the above number. You can use this as a burner SIM if you like. We will tell you how to put money on it. (Optional at extra cost). The drivers licence details we used to verify the locker. This is unique to your locker and consists of full name  DOB  licence number and state. You are free to use it for whatever purpose you want.  FAQ:  0. How do these things work?  - We set it up and do the ID verification. For operational details  see Australia Posts website at auspost.com.au 1. Don't I need the SIM card to operate the locker? - No. Most people just use the email account. 2. Can I start using the locker straight away? - Yes. 3. Is it good for domestic/International? - Perfect for domestic. For international  they have the same success rate as PO Boxes. Aus customs are anal  so good stealth goes a long way. 4. What if a parcel is redirected to the local post office (if  for example  the lockers are all full when my parcel arrives? - There is a method  and we'll show it to you if you buy from us. 5. Are there any ongoing costs involved in operating a locker? - None whatsoever. 6. Can I set up multiple lockers in my account? - Yes. One in every city if you like. You can add and delete lockers at will without triggering further ID verification. 7. Can I change the mobile number on the Auspost account without triggering an ID verification? - No. This is change from their old policy. Cannot be done any more.  8. How come you charge so much for the SIM? - Because it becomes equivalent to a burner SIM  and it takes more work to set it up. If you want a burner SIM  consider buying without SIM here  then buy a BYO burner SIM on our other listing. Of course  if you want your burner connected to the locker  you'll need to buy it on this listing.  That's it! Place an order today and get your locker details within 12 hours! We aim to provide Incredible service. If you have any questions  please message us.  If you have any issues with the locker(s) - not that we expect you will since it's all very straight forward - then please message us here. We've been using them for years and know pretty much all there is to know about them.,We guarantee full satisfaction!,Comments (0),
fbi hacking and forensic toolkit hack into phone,INSTANT DELIVERY TO YOUR INBOX  Welcome   This professional software worth THOUSANDS OF DOLLARS. for retrieving data  bypassing passwords  decrypting passwords for computers phones extracting data from computers and phones including passwords  deleted files  encrypted files  credit card numbers and more. ALL THIS sofware is Legitimate and worth thousands of dollars  -----  Instant Delivery for instant delivery  please dont write anything in the buyer notes.  These are some of the programs includes: Oxygen Forensics: http://www.oxygen-forensic.com/en/ Retrieve deleted texts bypass phone lock screens and more Finds passwords to encrypted backups and images Disables screen lock on popular Android OS devices Extracts data from clouds: iCloud  Google  Microsoft  etc. Offers import and analysis of call data records  Passware forensics: https://www.passware.com/kit-forensic/ Allows you to hack over 280 file types this works with elcomsoft software together. Hack all files Instant,No refunds.,Comments (0),
easy cardable low security website list 10 000,INSTANT DELIVERY TO YOUR INBOX  THIS LIST OF 10000 SITES WILL KEEP YOU BUSY FOR A LONG TIME.  STOP FAILING AT THE MAJOR BULLSHIT SITES AND START WHERE THE PROS DO.    CHECK OUT THE REST OF MY DIGITAL DISCOUNT MEGA STORE FOR MORE DEALS ON EVERYTHING DIGITAL AND THE BEST PRICES ON THE DARK-WEB MARKETS. GUARANTEE!,No refunds.,Comments (0),
watch me cashout credit card in front of you,INSTANT DELIVERY TO YOUR INBOX  Watch me cashing out CC right in front of your eyes.  COPY ME and make some   Don t BUY crap outdated guides  get a real VIDEO TUTORIAL and never look back    Probably many PRO carders know this method but they DONT want you to know it because its a REAL CASH MACHINE   Video content:  1 Checking socks if blacklisted  2 Carding 3 Getting pure 1000 in bitcoins in 1hr  5 Rinse and repeat    NOTE :  The site that i card in the VIDEO is down because it has been cashed out BUT i will give exact hint how to find new sites  they are plenty on the web   You will WOUCH me GUARANTEEEED,No refunds.,Comments (0),
destroy all tracks - secure eraser professional,Secure Eraser Professional Edition 5.000 Retail Multilingual  Erase Your Documents and Drives Securely.  Because it’s been deleted from your hard drive  doesn’t mean it’s gone forever. As long as the information was not overwritten  anyone can restore it at any time. It gets even more complicated  if a computer has been resold or given away.  Secure Eraser uses the most renowned method of data disposal and overwrites sensitive information in such a sure way that it can never be retrieved – even with specialized software. Our multiple award-winning solutions for definitively destroying data also eliminate any cross-references that could leave traces of deleted files in the allocation table of your hard drive.  This easy-to-use Windows software will overwrite sensitive data even up to 35 times – regardless of whether they are files  folders  drives  recycle bin or traces of surfing. You can also delete files that have already been deleted  but this time for good.  Secure Eraser not only overwrites using random data  it offers the approved US Dod 5220.22-ME and U.S. DoD 5220.22-MECE standards from the US Department of Defense  the German industrial standard and the Peter Gutmann standard. All deletions are logged in details upon request.   We decline any responsibility on the use you will have with our products. Product sold for informational purposes only.  Everyone is free to choose their use...,Non functional items will be refunded.,Comments (0),
one click mac address changer,INSTANT  DELIVERY TO YOUR INBOX    This is the easiest and most effective Mac Address changer on the market.,No refunds.,Comments (0),
erase all evidence - super eraser 5.0 business,Super Eraser 5.0 Business + Portable / AdvancedPE  Best security eraser with US Army standarts  DoYourData Super Eraser - рowerful data erasure software to permanently erase files/folders  wipe hard drive data  wipe unused disk space or erase data on storage media. DoYourData Super Eraser  easy-to-use yet powerful data erase software  is designed for permanent data erasure. It provides easy and secure solution to permanently wipe hard drive data  erase selected files/folders and wipe unused hard disk space. It also can permanently wipe data on storage media like USB drive  memory card  digital camera  SD card  external hard drive etc.  Three Data Erasure Modes * Erase Files/Folders - selectively and permanently erase files and folders from hard drive or storage media. * Wipe Hard Drive Partition - completely wipe entire hard drive partition/device to wipe all existing/lost data and traces on the partition or device. * Wipe Free Disk Space - securely wipe unused disk space and erase all the lost data or traces on your hard drive without affecting your existing files.  Secure Data Destroy & Wipe Solution DoYourData Super Eraser Business is fully capable of erasing selected data with fully certified standards (HMG Infosec  DoD  US Army AR  Peter Gutmann) without affecting the service life of the device. We promise that the erased data is lost forever  can't be recovered by any data recovery software or manual service.  Avoid SecurityThreats with Super Eraser Business If the important data falls into the wrong hands  it could lead to loss of business  privacy  property  reputation or even lead to crime. It is strongly recommended to permanently destroy sensitive data before selling  recycling  donating  lending  throwing away your computer or other device with DoYourData Super Eraser Business.  We decline any responsibility on the use you will have with our products. Product sold for informational purposes only.  Everyone is free to choose their use...,Non functional items will be refunded.,Comments (0),
cc validator ++ ipbin ++ bin checker ++bin search,INSTANT DELIVERY TO YOUR INBOX  Validate  Verify  Check Credit Card or Debit Card Number  This checker will support all major credit and debit card brands: VISA  MasterCard  American Express  Diners Club JCB  Voyager  Once you type in just the number of the card it will give you this information: BIN   Account Number   Checksum   BIN Details Details for BIN  BIN   Issuing Bank   Card Brand   Card Type   Card Level   ISO Country Name   ISO Country A2   ISO Country A3   ISO Country Number   Issuers Website   Issuers Contact    Combo IP/BIN Checker and Validator   IP/BIN Checker tool is designed to check a possibility of fraud for credit card transactions. The IP address is used to find the customers current location while the bank identification number BIN identifies the card issuing bank and its country of issuance. Both checks will allow specific combinations of two countries thus identified whether the transaction to be accepted or rejected.  Both IP address and Bank,No refunds.,Comments (0),
apple pay carding guide make thousands updated,★★★★INSTANT  DELIVERY TO YOUR INBOX★★★★  I would first like to introduce myself. My name is breadsdrugged I have spent more than 5 years making money online with sly methods.  I have always found the darkweb interesting and I have stepped in to sell methods.  You see many methods of $1 of which 90% is qualitatively not good. I love to deliver true quality for premium prices.,No refunds.,Comments (0),
-== avast antivirus package ==-,Avast Internet Security 2017 includes an antivirus  a robust firewall  a simple spam filter  and a wealth of bonus features. Depending upon your needs  though  a less expensive Avast product could be more cost effective.  *NOTES* :  - There are no refunds/exchanges after purchase. - Do not change any details of this account!,No refund,Comments (0),
norton 360 with lifelock ultimate plus,349.99  Annual Subscription Price  1 year,,Comments (0),
[DD] ccleaner business pro edition serial key instant,Welcome   For Windows and MAC CCleaner Business Pro Edition removes cookies  temporary files and various other unused data that clogs up your operating system. This frees up valuable hard disk space allowing your system to run faster.  CCleaner's patented technology gives you healthier  optimized PCs. So you can get on with doing what you do best – running your business.  Removing this data also protects your anonymity meaning you can browse online more securely. The built in Registry Cleaner fixes errors and broken settings to make your computer more stable.  Because I'm a new user in this community  I'm trying your trust and I'm selling CCLEANER Business Pro Edition + serial key at a very special low price. In the future this guide will be sell at a higher price. HURRY UP!!!!  Thanks for everybody for the amazing support and for contributing for this huge success.  In your service   Team rvaska,Allowed,Comments (0),
netgate registry cleaner - clean all traces,NETGATE Registry Cleaner cleans and defragment your registry  speed-up your PC  removes unneeded files on disks  removes activity traces. It includes Startup manager to manage programs started at Windows startup and Uninstall manager for handy applications uninstall. Supports scheduling of scans and backup option for better security.  Traces Removal:      Recent Documents List     StartMenu Run List     Windows Media Player Recent File List     Last Visited     OpenSave Files     MS Paint Recent Files     MS Wordpad Recent Files     Internet Explorer Typed Urls     Internet Explorer Saved Passwords     Firefox Urls/Saved Passwords     Firefox History     Search Assistant     Firefox Cookies     Opera Cookies     Internet Explorer Cookies     MS Office Recent Files     MS Word Recent Files     MS Excel Recent Files     MS PowerPoint Recent Files     Adobe Reader Recent Files     Nero Burning ROM Recent Files     Direct X Recent Apps     QuickTime Recent Movies     RegEdit Last Key     RealPlayer Recent Clips,Non functional items will be refunded.,Comments (0),
trojan remover 6.9.4.2943 final + cracked-snd,Best antimalware program. Stay safe on Darknet.  Trojan Remover aids in the removal of Malware - Trojan Horses  Worms  Adware  Spyware - when standard anti-virus software either fails to detect them or fails to effectively eliminate them. Standard antivirus programs are good at detecting this Malware  but not always good at effectively removing it.  Trojan Remover runs on Windows 10  Windows 8/8.1  Windows 7  Windows Vista and Windows XP.   The majority of Virus and Trojan Scanners are well able to detect malicious software - Trojan Horses  Internet Worms  Adware/Spyware etc. - but are not always very efficient in removing them once they have been triggered.  Trojan Remover is designed specifically to disable/remove Malware without the user having to manually edit system files or the Registry. The program also removes the additional system modifications some Malware carries out which are ignored by standard antivirus and trojan scanners.  Trojan Remover scans ALL the files loaded at boot time for Adware  Spyware  Remote Access Trojans  Internet Worms and other malware. Trojan Remover also checks to see if Windows loads Files/Services which are hidden by Rootkit techniques and warns you if it finds any.    We decline any responsibility on the use you will have with our products. Product sold for informational purposes only.  Everyone is free to choose their use...,Non functional items will be refunded.,Comments (0),
♚ securitys best hacking guide ♚,♚ Securitys Best Hacking Guide ♚  Securitys Best Hacking EBooks  List of this Product  5-best-practices-to-make-security-everyones-business GEEKBOY.IR Applied_Network_Security_GEEKBOY.PRO CEH Certified Ethical Hacker Practice Exams  Third Edition CEH v9 – Certified Ethical Hacker Version 9 Practice Tests GEEKBOY.IR CEH v9 Certified Ethical Hacker Version 9 Study Guide  3rd Edition GEEKBOY.IR Certified Ethical Hacker (CEH) Foundation Guide GEEKBOY.IR CISA – Certified Information Systems Auditor Study Guide GEEKBOY.IR CISSP (ISC)2 Certified Information Systems Security Professional Official Study Guide 7th Edition CompTIA Security+ Certification Practice Exams  Third Edition (Exam SY0-501)_GEEKBOY.PRO DDoS Attacks Evolution  Detection  Prevention  Reaction  and Tolerance Ethical Hacking 101 How to conduct professional pentestings in 21 days or less! Volume 1 GEEKBOY.IR Hacking the Hacker Learn From the Experts Who Take Down Hackers GEEKBOY.PRO Kali-Linux-Web-Penetration-Testing-Cookbook-GEEKBOY.IR Mastering_Kali_Linux_for_Web_GEEKBOY.PRO Network Security Assessment Know Your Network  3rd Edition Network Security Assessment Know Your Network  3rd Edition Nmap  Network Exploration and Security Auditing Cookbook - Second Edition NTP Security A Quick-Start Guide GEEKBOY.IR Securitys Hacking Guide SSCP Systems Security Certified Practitioner All-in-One Exam Guide  2nd Edition Ultra_Hackers_Training_Kit - GEEKBOY.IR  And Much More..!! Why Buy from us: - We deliver full support on all of our products  So if you have any questions please let us know. - All our guides work world wide - You will get a 100% satisfaction guarantee  so if you are not 100% satisfied with your purchase we will refund your order. - If you leave positive feedback you will get a product of your choosing for free. - Instant delivery.  If you have any questions please let us know.,Please don't forget to release the order and feel free to leave feedback. if you have any issue please contact me first   Have a nice day,Comments (0),
change your mac by one click - must have for secur,Changing of MAC address is one of most important things when you carding or doing other things on Darknet. This software allow you do that on very professional way by one simple click.  It's easy   revertible and secure.   We decline any responsibility on the use you will have with our products. Product sold for informational purposes only.  Everyone is free to choose their use...,Non functional items will be refunded.,Comments (0),
-==  mcafee total protection ==-,With the McAfee Total Protection product  you get the premium antivirus  identity and privacy protection you need for your PCs.  *NOTES* :  - Guaranteed 1 Open spot to protect your device. - There are no refunds/exchanges after purchase. - Do not change any details of this account  It will stop working!,No refund,Comments (0),
2023 easy one click mac address changer,INSTANT  DELIVERY TO YOUR INBOX    This is the easiest and most effective Mac Address changer on the market.,No refunds,Comments (0),
fbi hacking and forensic toolkit hack into phone,INSTANT DELIVERY TO YOUR INBOX  Welcome   This professional software worth THOUSANDS OF DOLLARS. for retrieving data  bypassing passwords  decrypting passwords for computers phones extracting data from computers and phones including passwords  deleted files  encrypted files  credit card numbers and more. ALL THIS sofware is Legitimate and worth thousands of dollars  -----  Instant Delivery for instant delivery  please dont write anything in the buyer notes.  These are some of the programs includes: Oxygen Forensics: http://www.oxygen-forensic.com/en/ Retrieve deleted texts bypass phone lock screens and more Finds passwords to encrypted backups and images Disables screen lock on popular Android OS devices Extracts data from clouds: iCloud  Google  Microsoft  etc. Offers import and analysis of call data records  Passware forensics: https://www.passware.com/kit-forensic/ Allows you to hack over 280 file types this works with elcomsoft software together. Hack all files Instant,No refunds,Comments (8),m******: super speedy delivery and a whole lot of educational goodies. THANKS YOURE THE BESTc******: THANKSr*********: goode*******: Instant delivery. All links working.m*********: FIRE TOOL THANKS SO MUCH A++b************: Thank you bro! Instantly delivered as promised and loaded with insane amounts of awesome info  tuts  and links....AMAZING! I'll def be back for more business with you my friend!m********: instant delivery to inbox as advertised.j********: I wish I had this before I bashed my wifes cell phone.  Thank you!
