Heading,Tab1,Tab2,Comment,CommentInfo
opsec trainings and setup,Operational Security (OpSec) ============================  Price for one day! (man/day)   ---------------------------- - Content full training - ----------------------------  Target of the service is to: - make you fully security aware   - capable to clearly define valuable assets  information  processes  personnel and similar  - define vulnerabilities - from whom and how to protect it  - control of activity emissions - circles of trust - know your adversaries  their capabilities  resources and determination  - deception techniques - personality compartmentalization techniques  to be able effectively withstand long-term personality compartmentalization stress  - have well designed contingency plans and business continuity plans for all defined situations.  At the end of the day  you will have a very clear  strong and highly resistant security posture  with early warning deception trigger traps in place.    ----------------- - Conditions - -----------------  - You and us will be available fully committed to the task for the agreed time online on email and chat  unless mutually agreed otherwise. In case of any issue  contact us through encrypted AND signed assigned email before the scheduled time. If no information is passed to us  you pay also for the time you are not available. - Tails is a preferable tool for this task. If you are capable to use Qubes  even better.  - All communication will take place through encrypted and anonymous channels using PGP in case of email (preferable) and/or qTox in case of chat or/and Bitmessage. All communication MUST be encrypted AND signed (PGP).  - Use hidden services email with .onion so that you are not unnecessarily exposed to the clearnet.  - We DONT send you files or links ever  with this OpSec training.  - IMPORT OUR PUBLIC KEY AND CHECK SIGNATURE OF EVERY MESSAGE FROM US! World is a hostile place.  Drop us a message and we will adjust the training based on your skills and goals and estimate the time needed to get it done. This consulting and setup will take more than one day. Try to keep the training flow uninterrupted. Dont take a day off during the training please. You will forget what was the topic  it will slow down the whole process and at the end  you will pay more.,It is consulting service and cant be refunded.,Comments (0),
kaspersky total security license and key for 1 dev,Kaspersky is one of the most well-known brands in the computer security industry and its products consistently perform well on tests conducted by reputed independent testing companies  such as AV-Test and AV Comparatives. In 2016  Kaspersky Internet Securitywhich uses the same malware protection as the antiviruscaught 100% of prevalent viruses and 100% of zero day viruses.,,Comments (0),
packstation ohne regstierung von id,Wie viel ist dir deine Identität wert ?  Möchtest du im Darknet einkaufen und es in die Packstation liefern lassen dann bequem mit deinrt Karte abholen ?  Dann bist du hier genau richtig !   eine komplette anleitung wie du DHL Packstation karte bekommst auf einen Namen deiner Wahl ohne dich Identifizieren zu müssen im Jahr 2023 lebenslaenglich  10 EUR promo ab 15.2 kostet das Packet 50€  Safty First By DRUGMAZON,Keine da es funktioniert,Comments (4),"f**************: topd*********: schnell geliefert danke euchn*********: Danke ! jetzt kann ich bedenkenlos meine "" lieferungen "" erhalten und falls es auffältt ist es mir relativ egal hahahahh*******: Super Service."
pia vpn,PIA VPN PIA VPN  9 Month Protect your online privacy with the worlds leading VPN,,Comments (0),
learn wi-fi password penetration testing wep  wpa ,Learn Wi-Fi Password Penetration Testing WEP  WPA  WPA2    46+ Videos to teach you how to hack and secure Wi-Fi WEP  WPA  WPA2  WPA/WPA2 Enterprise  ----  What will you Learn?  - Have a good understanding of how networks operate  - Understand how devices communicate with each other in a network  - Discover wireless networks within range  - Gather information about wifi networks  - Discover connected devices to each wifi network within range  - Disconnect any device from any network within range  - Learn the main weaknesses of WEP encryption and how it can be cracked  - Launch interactive packet reply attack to crack WEP encryption  - Launch chopchop reply attack to crack WEP encryption  - Launch fragmentation attack to crack WEP encryption  - Learn WPA/WPA2 weakness and the theory behind cracking it  and more  Complete description : textup.fr/465711Jn,-,Comments (0),
