Title,Description
♔ rolex confidential identification ebook  ♔,This listing is a listing for a confidential Rolex law enforcement product identification manual / guide book. This is an ebook made from the high resolution scans of an original Rolex confidential do...
-== email leads ==- fresh - 200k emails,"=============================================================

Selling fresh mixed or Usa email leads ready for spam, extracted from online shopping sites databases.

Leads are FRESH and Unspammed bef..."
-==  fresh domain smtp ==-,"=============================================================

Fresh smtp domains for sending mass emails. Our SMTP are configured on clear-IP Server.
Mailing directly to target's inbox all base on ho..."
msr what it is how to use it,"MSR what it is how to use it

Why Buy from us:
- We deliver full support on all of our products, So if you have any questions please let us know.
- All our guides work world wide
- You will get a 100%..."
classified documents from china,"Willing to purchase classified documents from Chinese government and military departments.
IF you have what i need in hand , PLEASE CONTACT ME with PGP."
♚ scamming foundations ♚,"♚ Scamming Foundations ♚

Why Buy from us:
- We deliver full support on all of our products, So if you have any questions please let us know.
- All our guides work world wide
- You will get a 100%..."
watch me cashout credit card in front of you,"INSTANT DELIVERY TO YOUR INBOX

Watch me cashing out CC right in front of your eyes. 
COPY ME and make some  
Don t BUY crap outdated guides, get a real VIDEO TUTORIAL and never look
back  

Probably ..."
scammers used google adsense to drop malware,"Scammers Used Google AdSense to Drop Malware on Android Devices

Why Buy from us:
- We deliver full support on all of our products, So if you have any questions please let us know.
- All our guides wo..."
"2023 cream of onion 16,000+ updated deepweb links","INSTANT DELIVERY TO YOUR INBOX

THESE ARE THE LATEST AND THE GREATEST OF TOR FOR 2023.

THIS IS THE MOST UP TO DATE AND LARGEST 2023 LIST OF DEEPWEB LINKS ON
THE MARKETS. JUNE 1 2023 UPDATED

IF YOU C..."
paypal latest cashout guide cc/cvv to btc,"★★★INSTANT DELIVERY TO YOUR INBOX★★★

This is an in depth guide on turning a paypal account to bitcoin.  Many
bitcoin selling exchanges accept paypal now.
It is an easy to follow guide on ..."
fullz cashout guide latest cc/cvv online shopping,"★★★INSTANT DELIVERY TO YOUR INBOX★★★


This will teach you how to cashout CC/CVV and FULLZ online shopping.

IMPORTANT: THIS IS A GUIDE, NOT FULLZ"
cell 411 smartphone app is polices worst,"Cell 411 Smartphone App is Polices Worst Nightmare

Why Buy from us:
- We deliver full support on all of our products, So if you have any questions please let us know.
- All our guides work world wide..."
